description,subcategory,,a
"HHC device was accidentally left out of DF Cart 433 upon attaching the final metal locking seals, by DF Operator Allyson Jones, (421819) HHC Serial no  ET00742",Equipment,,159
DF DONE IN THE CABIN NIL SALES   DF operators Mauricio Duarte 380364 and Randal Seyam 421026 went out in the cabin with their DF cart however no sales was made,DF Done Nil Sales,,159
"Preferred Meal Choice Unavailable      MsMcNamara didn't get her preferred meal choice (panang chicken curry) as it was a popular choice, but she was not upset",Equipment,,159
Toilet 3MF at ML3 Inop for service             Toilet had to be locked for the entire flight do to inoperative water faucet which had no water coming out of it,Seals,,159
Item missing duty free cart number (DF487)   Item (2058 Fervor montreal divine eye) was missing from drawer number (1)  Crew witness: Daniel alizraee (411422),Duty Free Items,,158
"ITEM MISSING  2178 MONSIEUR DE GIVENCHY EDT   DRAW 4 ITEM MISSING  2090 TOMMY HILFIGER TOMMY EDT   DRAW 4 Witness Viktorija Apostolovska,  428832 DF CART  208",Duty Free Items,,158
"Item number 2141 (Morgan Oates Gradient Floral Peach) missing from drawer 11, DF Cart Number 234   When I was opening DF cartcontainer I realized item missing",Duty Free Items,,158
DF1091 ISR Number 118070720002   Item 2097 from drawer one was opened (plastic removed from previous sector)   Item either defective or returned from customer,Duty Free Items,,158
"Duty free operator  Duty free DF 1012 cart was opened by Patricia ML4A, was meant to be assigned and operated by UL3; confusion of configuration 2 class cabin",Paper Work,,158
Difference between item available and stock information in DF 434   Item 2053 Reading glasses 25 available in drawer 6 instead of item 2051 Reading Glasses 15,Duty Free Items,,158
"Hand held computer stopped working before top of descent into Sydney No sales were done, only one item transferred out Duty free was not logged out and closed",Equipment,,158
Item 2041 Akita Electronics Follow Me missing from drawer 10 DF 460 Opening seals were correct The mentioned item was not found in any of the other containers,Duty Free Items,,158
Item number 2176 was missing from drawer number 6 DF366 on today's flight Duty free operator is Silvia Mio (435876) and I am her witness (Laura Friars 413313),Duty Free Items,,158
"different registration number    Due to aircraft change, the registration number of the aircraft is not matched on the machine on the machine, it shows A6 EOT",Seals,,158
"JAPANESE CHOICE  kindly be aware that the Japanese choice for breakfast and lunch included almost the same main dish, both Dainomono including a sea bass fish",Duty Free Items,,158
Customer complaint   internet not available in her phone  Customer was very upset as internet was inop in ther phone  Internet was working for other customers,Equipment,,158
Flight could not be closed flight was not downloaded in none of the kid tablets Couldn't synchronize the kis with the other Mod's No complaints from customers,Duty Free Items,,158
"Customer was drinking from his own bottle of alcohol     After take off, Mr Grimy and the group he was traveling with were observed drinking their own alcohol",Duty Free Items,,158
"Duty free for R1 position was conducted by Magdalena Rapeshovska, 455721 as the Purser operating as R1 (FG1) Tiziana Mifsud, 383374 did not have the DF pouch",Duty Free Targets,,157
DF 515 HHC number ET00608  HHC was inoperative  No closing stock from previous crew  DF items were not counted due to this as there was no point of reference,Equipment,,157
DURING COUNTING OF DF CART DF628 ITEM NUMBER 1973 STROILI MAHÉ CUFF RING ON DRAWER 12 WAS MISSING  DUTY FREE OPERATOR: LUDMILLA ORNELLAS STAFF NUMBER 421036,Duty Free Items,,157
item 2135 from DF1013 was forgotten to be transfered out of my DF machine (Lucia Pabisova 393591)   item was transffered in to cart 1014 and sold to customer,Duty Free Items,,157
"On the flight EK 009, DXB   LGW sector , the duty free card number DF 486, two refunds have been made: the first of 740 dirhams and the second of 275 dirhams",Duty Free Items,,157
"HHC Inoperative My HHC wasn't working during NRT DXB sector, also I couldn't find closing stock inside the cart Duty free cart number 1052 HHC number BA00815",Equipment,,157
duty free seals missing   Upon security search:  The seals from duty free containers DF848 were missing  The seal from the duty free DF848 cart was available,Seals,,157
"Upon opening DF853 cart, Item number 1974 Anti radiation Patch was missing from drawer 10   this has been witnessed by my colleague Zeyad Elmestekawy s441080",Duty Free Items,,157
"Tommy Hilfiger Tommy,EDT100ml was missing Item number 2090 drawer 6 Items sold on previous sector was not updated in the handheld computer DF cart number 369",Duty Free Items,,157
In DF cart 888 were missing two items: from drawer 3   item no2137   Emirates dual USB charger and from drawer 8   item no2115   Little Travellers Embroidere,Duty Free Items,,157
"Item 2168 was transferred out, but it still showing at NIL stock 1 DF077 from crew member s 454219  Crew s451221 sold the item when transferred in from DF078",Duty Free Items,,157
Customer was upset that they were denied bassinet for their baby on this sectorCustomer claimed that they have been given a bassinet on their previous flight,Seals,,157
Customer wanted to eat lamb  no more lamb left  no more special meals or crew meals available as they were only loaded for one sector  customer denied to eat,Duty Free Items,,157
"Customer complained that she is not seated next to her partner  While boarding, she informed the cabin crew that she is not seating together with her partner",Seals,,157
Mr & Mrs Leaderpicone were disappointed that there was not a seafood option as part of menu We were able to offer alternatives which they appeared happy with,Duty Free Items,,157
Customer experience    All customers were escorted to their seats 3 customers enjoyed dinner and 1 had continental breakfast Thanked crew for a lovely flight,Equipment,,157
Screen frozen      During boarding customer informed crew the screen was blank  The screen was blank and black and was unable to switch on using the controls,Seals,,157
CUSTOMER WANTED TO SEAT BY EMERGENCY EXIT      Mrs Aluthweediyakorala asked me to seat by Emergency exit (41ABC) which were vacant however customer is a WHCR,Duty Free Items,,157
The seal from the cart 873 has be broken a top of decent to look For an item I am replacing it with seal A015745581 It was previously sealed with A015745581,Seals,,156
"missing item  While counting Duty Free cart DF1159, a missing item in Drawer 06 was discovered   2061 Revlon Super Lustrous Lips ( ISR Number 117946430002 )",Duty Free Items,,156
"missing item  While counting Duty Free cart DF938 Drawer Number 7, a missing item was discovered   2109  A380 1:1000 Scale Plane ( ISR Number 117946420002 )",Duty Free Items,,156
"Defective item no 2097 wallet    Item no 2097 has a defect, after making a sale to the customer, he realised that item was a piece of plastic was broken off",Duty Free Items,,156
"The HHC doesn't turn on properly, it only displays a white page and doesn't continue to allow further login Duty free cart DF 466, HCC serial number BA00689",Equipment,,156
I had showed a customer duty free item no 2097 from drawer 1 and forgot to put in back in my cart before I closed and sealed My duty free cart number is 323,Duty Free Items,,156
crew was not able to go in the cabin with the Duty free cart because on top of decent crew was still in the cabin with the meal clearance carts from service,DF not done,,156
HHC batteries low battery  other extra batteries were dead  cannot log in using the HHC  went out in the cabin with DF cart  Items not counted no sales made,Equipment,,156
Duty free target was achieved on this sector HKT DXB   Target 1500 AED   Combined total sale: 3145 AED   Duty free operators: Rina 224792 and Watawan 377356,Duty Free Targets,,156
Handheld computer is not turning on I tried changing batteries and it didn't switch on either I couldn't count items and couldn't check seal numbers  DF 840,Equipment,,156
Duty free magazine loaded in the seat pockets of every cabin had the new magazine issue (no 45) while the duty free carts had the old magazine issue (no 44),Special Offers,,156
"Drinks service delayed KIS tablets and MODs stopped syncing after take off for a while, it created disruptions and delays in the drinks service before lunch",Equipment,,156
"Braised  Beef main course average qualityWhen I asked MrAlsaleh about his main course , customer stated that it was a bit dry and salty ,quality was average",DF Done Nil Sales,,156
Duty Free cart did not have time to go to the cabin      Duty free did not take carts into the cabin But customer requests and sales where made by the crew,DF not done,,155
Item number 2153 1 from DF cart 1005 was defective and was put back in DF HHC pouch  Item was sold to a customer but was refunded on board  Purser informed,Duty Free Items,,155
NO DUTY FREE SALES  Crew members Dimitra Tsioli Staff number: 435365 and Apostolia Charalampaki Staff number: 447413 made no duty free sales on this sector,DF Done Nil Sales,,155
"While I was helping the duty free operator to seal the duty free container DF 982, I made mistaking by not putting the seal through the handle and the lock",Seals,,155
"there are two items missing from duty free cart no 551 1 item no 2172 drawer no 4 , Tiffany Co EDP 75ml 2 item no 2018 drawer no 6 , Anne klein charm watch",Duty Free Items,,155
DF cart088  HHC BA01220 inoperative  Note left from previous sector HHC is inop  No closing stock report left and no printout paper left from previous crew,Equipment,,155
"Duty free was done on both sectors but i forgot to log in the hand held computer on the second sector, Sealed as per normal with seal numbers75010368404142",Seals,,155
"A champagne sale was made, but the customer changed his mind afterwards The HHC does not have a refund for champagne sale DF ISR number 117890290001 DF 528",DF Done Nil Sales,,155
DF 515 Item number 2027 (Tangle Teezer Bronze) was not found in Drawer 5 upon stock count Stock count was witnessed by crew member Surraiya Gurung (383165),Duty Free Items,,155
duty free target exceeded    duty free target was 1400 dha while the sales were 1920   crew members assigned for duty free Lokesh  401608 and Salima 431031,Duty Free Targets,,155
Mrs Kenyon came to the aft economy galley to complain to crew after she claims she was disappointed with Emirates  mainly the food quality and seat comfort,Seals,,155
Expected turbulence   Captain informed us that approaching London we will face turbulence and he said he will want everyone to be secured early for landing,Duty Free Items,,155
In the duty free cart 099 06UL2 2U201 drawer 5 during count of open stock it was undiscovered that an item 2110 little travels key chain was found missing,Duty Free Items,,154
Duty free 510 handheld computer was not working Handheld computer doesn't have serial number Duty free was closed with following seals: 750107476647674768,Equipment,,154
One of the duty free seal on the DF 049 didn't match the number from the HCC for R1   Container with drawer no 8 and 9 was sealed with seal no: B020749777,Seals,,154
Cart no DF 452 was opened  Tried to open the cart to put back the handheld machine back The padlock did not open so the hand held machine was left outside,Equipment,,154
Broken watch strap (Fervour Montréal Divine Eye watch) item 2057 7   Found in Duty free cart 536 by staff 438650 witnessed by staff Matthew Sammut 391995,Duty Free Items,,154
"DF 534 HHC stuck in the middle of a transaction, transaction not finished No possibility to restart HHC Not possible to close DF Nil sales Purser informed",Equipment,,154
The HH computer in DF cart number 1129 is not working  it starts by showing normal starting loading screen but then switches off by itself after 8 seconds,Equipment,,154
Customer seat IFE kept pausing and playing for the whole flightMr McAuliffe informed me that his entertainment system kept pausing playing while on ground,Equipment,,154
OPENING DUTY FREE SEALS MISMATCH    All physical previous closing seals were not matching the one saved in the machine   No items were missing after count,Duty Free Items,,154
IO CUSTOMER      Mr Mann was an IO customer travelling in JC who boarded from the UL1 door  Customer was escorted to the aircraft by a ground staff in DXB,Duty Free Items,,154
DUTY FREE DONE NO SALES  Crew members Diego Lopez Staff number: 345505 and Soumaya Khadhraoui Staff number: 414710 made no duty free sales on this sector,DF Done Nil Sales,,153
Duty Free number 86 hand held computer INOP Duty free number 86 hand held computer not working Showed error 3 and then just keeps loading and never opens,Equipment,,153
"DF item 2097 TRU VIRTU from drawer 1 missing  Opening stock shows 2 items,actual number of this item in the cart was only one  Witnessed by purser 269636",Duty Free Items,,153
"DF cart 1033   Only one mental seal found in the pouch, Two mental seals are missing   2 containers were sealed with green seals (A015493441, A015493442)",Seals,,153
"DF1139      Found 1 extra item 1922 5 Cufflinks by Centurio Italy Due to item is not listed on HHC, could not adjust Cabin Crew name : Bomi Kim SN 377137",Duty Free Items,,153
Duty free cart number DF947 the hand held computer automatically shut down before the log out process has finished  the log out process was not completed,Equipment,,153
The duty free seals on cart number 935 did not match up The seal numbers were A015905800 A015905801 and A015905799 Duty Free Operator: Sara Patton 445650,Seals,,153
"item missing from Drawer 1 item number 2153 Ogon carbon clip Opening stock reports inventory of 2 However, only 1 item found in drawer Df cart number 356",Duty Free Items,,153
"duty free highest sale exceeded    the highest sale for sector is 1770, sales made on the sector 2871 target reached by duty free operator Louise  275505",Duty Free Targets,,153
"While counting the duty free items, i observed one item was missing: item no:2115, Little travellers Embroidered stickers, Duty Free Cart DF389, drawer 8",Duty Free Items,,153
"During meal service, customer was offered meal tray by crew Lejla Becirovic 439911 and pointed out that she was not happy the dessert was missing a cover",Duty Free Items,,153
During boarding customer was stressed about the delay from Auckland and was worried that she will miss her two connecting flight Customer looked stressed,Seals,,153
After seat belt sign on for landing Ms Tahir vomited once  Customer had no history of vomiting and no medication with her   No MIRF or medication offered,Duty Free Items,,153
"Used jam jar on breakfast clean tray     On one of the Continental breakfast tray,  which was given to the customer, there was a jam jar  opened and used",Duty Free Items,,153
"Basinet seat booked       Dr Okohue informed me during boarding that they had booked a basinet seat, Row 37, which was confirmed on his booking reference",Seals,,153
Choice unavailable      During lunch service Not all customers got their meal of choice the reason why is many customers requested for the chicken option,Equipment,,153
Kit bag was opened           Mr Pavlides received a kit bag that was already opened  He claimed that it was opened and the amenities inside were all used,Duty Free Items,,153
HHC not working on the sector DMM DXB  Could use the HHC only on DXB DMM sector  Didn't have time to count Duty Free (very short sectors)  DF number 827,Equipment,,152
"Cabin crew Nay Linn Htet 397989 sold AED7313 on EK003 to LHR   He recommended items, was present in the cabin with the cart and encouraged people to buy",Duty Free Targets,,152
1 Missing Item    Item no2115 from drawer no 8 of DF cart 542 is missing upon physical counting of the opening inventory   Witnessed by CSV Jamie 377400,Duty Free Items,,152
Crew Daria Kholmogorova 446462 DF cart 840 had missing item in Drawer 7 item 2114 emirates keychain vitness Suzanne González Garcia staff number 446732,Duty Free Items,,152
Not logged out and no seals placed into DXB    Crew member into DXB did not log out from the HHC and did not place the metal seals into DXB after landed,Seals,,152
DF309 has an item number 2108 Encino 12 in 1 Aviation model set missing from drawer 10 Witness for the stock count is Desy Setiawati staff number 208795,Duty Free Items,,152
"When counting my Duty Free, I found 20 items instead of 21 in the drawer number 06   DF886 Item 2057 ( Fervor Montreal Divine Eye Necklace ) was missing",Duty Free Items,,152
"Missing Item On the above sector, the following item was missing from the relevant DF cart  881, Drawer 11 and item  2012: Tateossian Skeleton Cufflinks",Duty Free Items,,152
"Missing Item On the above sector, the following item was missing from the relevant DF cart  881, Drawer 11 and item  2012: Tateossian Skeleton Cufflinks",Duty Free Items,,152
"Item missing   There duty free item Little Travelex embroidered stickers 2115,drawer 8, Duty Free cart 1014 was missing  Witness Irina Gheorgieva 408561",Duty Free Items,,152
"Missing item in duty free cart    Drawer no6 was missing item number 2132the Dyrberg kern trvl fairy tales bangles , but it was showing in opening stock",DF Done Nil Sales,,152
Duty Free items for this flight on carts No DF869  DF870 don't correspond to the ones available on the magazine   Old Product selection but new magazine,Duty Free Items,,152
Duty free cart no DF568 One of duty free containers was found missing white sealFound by duty free operator Eunji Sung 453836Number of items was matched,Duty Free Items,,152
After boarding Mr Almazrouei disappeared from the upper deck cabin he left 2 bags on his seat and left without notifying the cabin crewsenior in J class,Duty Free Items,,152
Wet seat    After dinner service customer complained to me that she spilled all cup of noodles over her seat while taking her bag down from the hat rack,Duty Free Items,,152
Seal broken into DXB   DF cart number DF068 seal broken due to service recovery item Customers head seats crushed whilst crew preparing seat for landing,Equipment,,152
"Mr Samson asked crew for Scotch from premium cabins  After crew explained that it is not allowed, customer stated Bring it, I know that you can bring it",Paper Work,,152
"HNML  COMPLAINT     Mr Bhargava stated that the HNML wasn't appealing, he said its looks like diabetic meal  He requested for a normal meal tray instead",Duty Free Items,,152
IO CUSTOMER      Mr Al Meheiri was an IO customer travelling in FC who boarded from the UL1 door Customer was escorted to the aircraft by a ground staff,Duty Free Items,,152
"Missing item from DF1017      While counting the items, I found item2035 from drawer7 (Buckley London Aspire pendant, earring & bangle set) was missing",Duty Free Items,,151
"While trying to transfer in, handheld computer no BA00735 of DF 1158 stopped working due to battery low  After changing the battery it couldn't turn on",Equipment,,151
error with HHC   when I tried to log out an error screen appeared on HHC therefor I could not close my duty free   HHC number 0506   DF cart number 187,Equipment,,151
"While counting duty free (DF426) stock in the cart and containers I discovered that one item is missing The item number is 1945, from drawer number six",Duty Free Items,,151
DF hand held device was not logged off   metal seals were applied: EKRS7501057220 EKRS7501057221 EKRS751057219   DF1041   Operator Jaimie Brough 454604,Seals,,151
"Duty free card number 112 has a missing item in drawer 10 Missing code item 2048 Morgan Oates Leopard Witness crew Marissa Cabrera, staff number 307985",Duty Free Items,,151
NO SALES ACHIEVED       Crew members Eun Suh Park s400265 and Ktistina Vukovcan s431814 were in charge of the Duty Free; however no sales were achieved,DF Done Nil Sales,,151
"Duty free pouch forgot inside duty free cart DF 488 Pouch contains 700 , credit card receipts and sales summary paper along with 500 AED from the pouch",Seals,,151
Red closing seal for Dubai was missing  EKRS 7501038212 from duty free blue pouch when opened duty free cart 355 from Led Dxb sector ek 176 on 27052018,Seals,,151
"while counting duty free items, 1 item 1946 Kolki child Guard phone in drawer 10 was extra itemexcess   the drawer was recounted by Clare Hehir s413491",Duty Free Items,,151
NEW DUTY FREE MAGAZINE:   Several customers have asked for items which were advertised in the DF magazines but this were not yet loaded in the DF carts,Duty Free Items,,151
I have removed the item no2104 2 Pandora Classic Starter bracelet  from opening stock on hhc computer by mistake The item is available in the container,Duty Free Items,,151
DF Cart 326   Missing Items     Item no 2019 in drawer on 5 was missing   The previous crew had left a note regarding the same   No extra battery found,Duty Free Items,,151
"DATA CARD NOT LOADED IN HHC HHC of cart 088 not operating Manual paperwork is the old one, so no updated Inventory of drawers Counting was not possible",Equipment,,151
On Duty free DF038 there were 2 items missing The “emirates key chain  remove before flight” both of them missingI can’t remember the item number,Duty Free Items,,151
duty free target exceeded    duty free target was 2000 dha while the sales were 2576   crew members assigned for duty free Lokesh  401608 and Le 423677,Duty Free Targets,,151
"During the boarding at UL1, I warm welcomed Sir Clark and his wife, I escorted Sir Clark to his suit and hang his jacket and I introduced myself to him",Duty Free Items,,151
Miss Sasha asked for normal meal instead of Hindu meal  Miss Sasha volunteered to offer her seat to a mother grovelling with a child occupying one seat,Seals,,151
New plastic seal was not able to lock DF809 cart      Green seal noA008609901 was used on top as double lock   Witness crew Panatporn Kamhongsa 387403,Seals,,150
item  2115 from drawer 08 was missing from DF Cart Number DF479 Drawer was count again by crew member Rebecca Mooney 436387 and item was still missing,Duty Free Items,,150
DUTY FREE DONE NO SALES  Crew members Gabriel Floriani Staff number: 398889 and Omar Gasmi Staff number: 419808 made no duty free sales on this sector,DF Done Nil Sales,,150
"Duty free Cart 404, drawer 08  On counting the duty free items, it was found that item number 2115 (Little Travellers Embroidered Stickers) is missing",Duty Free Items,,150
"DF266 Item:2155 Little Travellers Embrodiere Witnessed by G1 Heather Pearl 407120 Amended accidentally wrong item, the item missing is 2115 (not 2112)",Duty Free Items,,150
"on the sector DXB LHR no battery installed inside the HHC  When HHC turned on using spare battery, error Message popped up and unable to open terminal",Equipment,,150
Cabin crew Hyunmin staff number 446991 was operating as MR3   Handheld computer (serial number 2121049) was INOP DF cart number 549   No items missing,Equipment,,150
DF Items Missing    DF Cart Nos   DF 975 There were several items missing from this cart :   Ladies Bracelet Watch Set ( Item Nos 1573)   Drawer Nos 8,Duty Free Items,,150
Target exceeded   Target of 1800AED exceeded   Total sale: 3490AED   Crew Hye Rin Oh s392736 sold 2795AED   Crew Tatiana Tomasetti s426219 sold 695AED,Duty Free Targets,,150
ITEM 2141 DF cart number 046 Duty free item Morgan & Oates gradient floral peach was put in drawer no 3 instead of drawer no 11 when closing duty free,Duty Free Items,,150
Df cart number:df 138 Item number :2012 Item name: Tateossian skeleton gear drawer number :6 Witness crew name and staff number:Aoife McConnell 441732,Duty Free Items,,150
DF cart 05UL2 2U205 DF 963 Item no 2143 (Swarovski giggles pendant key) is missing from drawer 10 Unable to detect its location from searching drawers,Duty Free Items,,150
"AVML   customer claimed that she requested a vegetarian meal , but it does not show on her profile   she would like to have AVML on her future flights",Duty Free Items,,150
during welcoming service drink clearance gr1 Percy spilled by mistake champagne drink on mrsSpivey trouser while he was collecting her champagne flaut,Duty Free Items,,150
"Seat did not fully recline until the 3rs Reset       After the first Service when she wanted to sleep, her seat cannot be put on a fully flat position",Duty Free Items,,150
DF cart 365 Item 2036( Buckley London Aspire Set ) missing when crew Xiaoling Zeng (s451460) was counting  Witnessesed by Kristyna Kramesova(s441574),Duty Free Items,,149
"There were no Duty Free Containers fro YC loaded on this flight Catering advised us, that they can not bring them on time and we will go without them",Duty Free Items,,149
I was galley operator on the flight 415 SYD DXB on the 22nd business class I didn’t do any sales Galley hasn’t been close with seals Locker is on,Seals,,149
DF1152 DUTY FREE NUMBER     Drawer number 9 is missing item 1949 Pro Light world USB   Drawer number 11 is missing item 2012 Tateossian skeleton gear,Duty Free Items,,149
Item no 2182 benefit world o blushes was found missing in drawer 10   Seals number were correct   witnessed counting by CSV Naruedi Prasongbol 341246,Duty Free Items,,149
"HAND HELD COMPUTER TERMINAL  2120564, from DF cart 367 was faulty After signing in and printing OPENING STOCK, it gave an error and then switched off",Equipment,,149
DUTY FREE DONE NO SALES  Crew member Louise Dow Staff number: 410516 and Kristina Bagrova Staff number: 433940 made no duty free sales on this sector,DF Done Nil Sales,,149
Duty free did not go in the cabin due to service taking up the whole flight Could not release R1 as no CSV to cover and customers extremely demanding,DF not done,,149
