description,subcategory,,a
"Konstantinos was very positive from the beginning of the flightHe was very organised in the galley and always willing to assist his colleaguesHe took the initiative to do the catering checks and organise the pre departuresDuring boarding he was assisting mothers with infants and elderly people to their seats We had many elderly people on the flight and most of them did not speak English Konstantinos made sure they had their meal of choice and drink and also in between the services he ensured they had water and spend time helping them fill up customs forms as well as talk to them and make them feel comfortable He also reset screens that were not working and checked on customers to make sure that their screen was back on and always passed the information to meI could see people enjoyed being served their meals and drinks by Konstantinos as he was serving with a smile and always a positive commentVery positive and hard working, excellent teamwork skills and professional behaviour",Seals,,991
Baby sleeping on the floor non compliance to crew's instruction    Mr Couillerot was rude during cabin securing to crew member Seewoo when she asked him to put his stuffs in the hatrack to keep the bulkhead clear He didn't put his bags away until I came and ask him to  After take off he placed his baby on the floor with blankets and pillow The same crew member told me about it and I told him that the baby cannot sleep on the floor Mr Couillerot asked me to show where it was written and said that even if the baby was on his lap if we hit an air pocket the baby would be injured and that the rules by emirates do not make any sense Customer got very upset and said that we (purser and I) were not helping the situation and that we were not professional Baby was kept on the floor despite the warnings given to customer  He said  that the ground staff in paris assured him that he will get a bassinet  Passenger was shouting at the purser and I and wanted to have my staff number,Equipment,,982
"New Duty Free seals feedback   New seal system was in trail on the flight However the system doesn't show an impressive improvement of the safety and utility for the Duty Free operator In particular, the following critical points are highlighted:   new plastic seals are not as elastic as the old plastic seal, this results in a danger when the seals has to be broken as the seal cracks in several parts and these parts tend to jump creating a potential hazard for the safety of the surrounding people;   no extra seals were provided in the Duty Free carts, resulting in the impossibility to reseal the cart in case of last minute sale;   the door of the cart does not close properly due to the obstruction of the metal ring fixed to the handle loop;   during the flight the cart and the containers remain exposed to potential risk as no padlock or other security device is provided to prevent the access to the Duty Free products to not authorized people",Seals,,955
"Verbal abuse  Customer boarded as I was by the door at ML1, he was speaking loudly in his language and seemed upset about something  I approached customer and asked him if everything was alright, he kept walking and started shouting Why am I in Business class when my seat is in Economy Purser Don approached the customer to try and calm him down but customer continued to talk very loud  Purser explained calmly to customer that he was indeed in Economy where his seat was  A couple of minutes later Purser and myself approached the customer once he was seated to find out more about the reason of his outburst Customer stated that on a previous flight he was sent to the wrong cabin and he thought that it happened again today Customer was kindly but firmly reminded that if he has any issues regarding any flight that he should approach the crew for information or help and that there was no need to raise his voice in front of other customers",Duty Free Items,,946
"MALFUNCTIONING HANDHELD COMPUTER      HHC no S41280  CE0560  1759B014  CF Card Label: UAE1585, DF cart 490   Economy class customer Mr Khezer Khalaschi (seat 42D) purchased duty free item creed viking (no 2187 4)   Customer paid with credit card   Sale was processed but HHC printed out only the merchant copy of the credit card purchase receipt   HHC displayed an error when attempting to print cardholder copy   Customer stated he did not want the receipts   Sale was witnessed by CSV Jemima Kauai (406077)   VISA credit card, card valid, signature on the merchant copy matched the one on the credit card (double checked by the CSV)   Sale did not appear on the sales summary print out form the HHC when closing   Manual paperwork was done for closing duty free and submission for the cashier   Stock of Creed Viking (2187 4) was adjusted manually on the HHC when opening for the return sector (witnessed by CSV Ragini Arumugam   394287)",Equipment,,939
"MALFUNCTIONING HANDHELD COMPUTER      HHC no S41280  CE0560  1759B014  CF Card Label: UAE1585, DF cart 490   Economy class customer Mr Khezer Khalaschi (seat 42D) purchased duty free item creed viking (no 2187 4)   Customer paid with credit card   Sale was processed but HHC printed out only the merchant copy of the credit card purchase receipt   HHC displayed an error when attempting to print cardholder copy   Customer stated he did not want the receipts   Sale was witnessed by CSV Jemima Kauai (406077)   VISA credit card, card valid, signature on the merchant copy matched the one on the credit card (double checked by the CSV)   Sale did not appear on the sales summary print out form the HHC when closing   Manual paperwork was done for closing duty free and submission for the cashier   Stock of Creed Viking (2187 4) was adjusted manually on the HHC when opening for the return sector (witnessed by CSV Ragini Arumugam   394287)",Equipment,,939
"I opened duty free cart DF580 after the breakfast service in business class and logged in using my name and staff number Two sales were completed immediately after doing so at the request of two customers who wished to sleep After completing the sales, it was noticed that the handheld computer detailed cart DF589 as opposed to DF580, therefore it was established that the handheld computers appeared to have been placed inside the opposing carts This error resulted in a number of transfers being unable to be completed by both me and my colleague, 413098 The following items were transferred out by me to my colleague, 413098: Drw: 08 Code:1950 Item: Carolina Herrera Good Girl perfume Drw: 11 Code: 2136 Item: William L 1985 watch Drs 04 Code: 2085 Item: Gucci Bloom perfume The following items were transferred to me by my colleague, 413098: Drw: 11 Code: 1964 Item: Khiels Ultra Face Cream Drw: 12 Code: 894 Item: Encarta Afortunado",Equipment,,938
"unable to print out customers sales receiptsale did not appear on the sales summary print out from HH computer no S41280 CE0560  On flight EK0977 economy class customer Mr Khezer Khalaschi (seat 42D) purchased duty free item creed viking (no 2187 4), duty free cart no 490, hh computer no s41280 CE0560  the customer paid with the credit card  sales was processed and credit card purchase receipt was printed out, customers signature matched the one on the credit card  customer receipt was not printed out due to an unknown error of hh computer  the customer did not want the receipt  the sales was witnessed by the CSV Jemima Kauai (staff: 406077)  the sales did not appear on the sales summary print out from the hh computer   the stock of creed viking (no 2187 4) was adjusted manually on the hh computer (witnessed by CSV Raging s394287)  manual paperwork was don for closing duty free and submission for the cashier in dubai",Equipment,,930
"On the flight someone stole 400 aed from my duty free pouch which I had in my cabin bag I was assigned the galley position (was working in J class that day) and I had my cabin bag in 7AB hatrack Initially I had it looked, but then just before the take off, I took out my oven gloves which I forgot to do it at first place I forgot to locky cabin bag again and it was unlocked through the whole flight Unfortunately I realized that I was missing this money today on my other flight EK 450, while I was about to go to the cabin with my duty free cart I had my cabin bag locked on todays flight, even before realizing that the money was missing Also, just before my KWI flight I changed my duty free pouch, because in my previous flight I was assigned with the duty free position and I had sales When I was given the new pouch I counted the money and nothing was missing The incident unfortunately took place in the KWI flight",,,923
FYI :  Hand held computer all batteries drained out  Duty free done manually  Some items cannot be found(most probably sold last sectors) Items mentioned below are not found   1) 2036 1 (Buckley London mixed earring) 2) 2052 2 (You joue lip gloss) 3) 2080 5 (Ellie Saab girl of now) 4) 2092 6 (Lancome our bouquet) 5) 2040 7 (Akita electronics digital luggage scale) 6) 2026 7 (Cartier La panther) 7) 2057 7 (Fervour Montréal divine eye watch) 8) 2021 8 (EK twin set watch) 9) 1931 8 (Hermes Elixir des Merveilles calligraphic) 10) 1934 8 (Misfit shine 2) 11) 2084 8 (Tom ford tuscan leather) 12) 1779 9 (Gents watch set) 13) 2135 10 (Michael kors white pearl set) 14) 802 10 (six pendant earring set) 15) 1949 10 (Skross pro light world USB) 16) 1896 10 (Victorias secret scent with love crayons) 17) 2113 11 (EK dual USB charger) 18) 1971 11 (Stack of sparkle 3pc bangle set) 19) 1964 11 (Ultra facial cream by kiehls),Duty Free Items,,921
"Mrs Griffon appeared emotional   After boarding I went to speak to Mrs Griffon she acknowledged me however it was evident that customer tried to avoid direct eye contact and was not interested in talking to me  When I returned to the galley first class crew informed me that Mrs Griffon appeared emotional and was seen in tears  After take off when I presented the menus, customer took the menus and declined any drinks  Throughout the flight customer appeared emotional at time to time She was seen talking to her partner at 1F and her partner consoling her  Crew informed me that customer declined any give away items initially and later requested it, as there were only 3 female kit bags been supplied and all 3 had been given to other customers, Mrs Griffon offered a male kit bags which she accepted it  Crew informed she accepted meals offered to her  On disembarking noticed customer thanking crew with a smile",Duty Free Items,,917
"Mr Marco claimed disappointment and unhappiness about the flight  on ground customer was welcomed by CSV Francis who also apologized in calm manners to the customer regarding the shortage of the fast track customer pressed the Call bell and I went to attended it to find out the customer stating to me in rough voice tone  this is unprofessional ,I'm stuck here in the worst seat and I never offered any options regarding my seat ,I'm not happy ,find me away to get my fast track, what is wrong is happening with this journey ,I paid for this service so I must get it and no excuses are accepted I tried to calm the customer by apologizing but he stated  I will accept your apology if you are my friend but I paid you money to give me service so where is it  customer stated either I get my fast track or get my luggage down I don't wanna be on this flight I will wait for the next flight and fly with my girlfriend",Duty Free Items,,915
Crew member Qingwei 454115 sold duty free item number 2057 Fervor Montreal Divine Eye watch to customers It was sold from cart number 162 (MR3 duty free cart) Customer name  Mr LeiXue CAI seat number 86j They purchased using their credit card Just prior to descent they informed Quinwei that they wanted to exchange the item for another identical item as they said the watch that they received did not look properly finished as it was in the magazine ( crystals along the watch strap were not in a straight line) Due to time constraints Qingwei made an agreement with them that when she next came to china she would post the item directly to them Qingwei then took the item from them and placed it back in the cart instead of keeping the item with her She did not process the refund of the credit card as she said she would replace the item personally so that she could inspect the quality before giving it to them,Duty Free Items,,914
Customers GOLD skywards profile is not being recognised in the system    During boarding customer complained to me that his gold skywards status is not coming up in the system  He stated he has been a skywards member for 17 years and this problem has been happening for the past few months He believes his profile has been hacked by an online hacker   Customer wishes to be reimbursed for the miles he has lost and for the internet he has had to pay for onboard  Customer showed me his membership number  Customer showed me his email correspondence with the emirates data intelligence team and skywards which was originally sent on the 22122017  He states he has also sent an official written letter to the company  Customer wishes for this problem to be rectified immediately  Customer contact details are as follows:Mr Ali OdehSkywards Mem  EK00101530586Phone: 962795697770  19548428845E mail: aliodeh2@yahoocom,Equipment,,913
"DF 846 I was assigned as DF operator for the flight and I had some sales Items codes: 1931, 2085, 1946, 1963, 2049, 2190, 2099, 1964 1) While I was selling one of the products to our customers, my DF machine was showing the item 2049 as 'nil', even though I had the product in my cart I transferred the product from the crew Yasmim in the machine, physically took the item from her cart and sold it to the customer Therefore, there was still one item 2049 remaining on the cart by the time I closed it 2) After having done the bar paperwork and sealed the DF cart correctly with the seal from the pouch, I realized I had forgotten to put the C209 paperwork inside the cart Then, I broke the seal, put the C209 papers inside te cart and sealed it again with a regular seal from the amenities container All the papers regarding to DF are going to be delivered to the cashier once I am back to Dubai, on July 05th",Duty Free Items,,910
"Credit Card No Approval           Mrs Odonnell got upset when she cannot make a 2nd purchase with her credit cards Error message appears on the HHC and it froze when the card is swiped again   Crew member 452710 Oana has sold one item with the same credit card and sale was accepted after several attempts with the same card and 4 other credit cards prior, with some credit cards not signed   Customer got upset when manual transaction wasn't offered and wanted to pay with cash but with 20 AUD less than the actual price   Customer claimed that the 2nd item (20458 1) should have been given for free as she claims her credit card is working and it's the system that has a problem   Customer claimed that crew were rude and they don't know anything about duty free   Customer also claimed they had travelled on 4 sectors on Emirates (SYD DXB LHR DXB SYD), and this is the only flight when duty free was offered",Equipment,,910
"Cabin crew member GR1 Oindrila Goswami maximized the use of her language skill (Bengali) to regularly monitor Mrs Saida Begum, seated at 18F, who started to feel unwell at approximately two hours before landing I have observed her genuine concern, great empathy and compassion in dealing with the elderly customer When she came to know that the customer was suffering from gastritis, GR1 Oindrila made sure that the customer had something to eat and drink She also stayed with the customer for some time to offer comfort and reassuranceAs she was working in business class, she readily informed the economy class team about the sick customer and made herself readily available whenever there was a concern raisedUpon disembarkation, she offered assistance to the elderly customer and informed the special handling staff about her conditionAccording to GR1 Oindrila, the customer felt better prior to landing",DF Done Nil Sales,,907
"Feedback   MURCURE HOTEL on Stevens, Singapore    The hotel for all crew in Singapore changed to MURCURE ON STEVENS, since end of December 2017 The rooms allocated for all crew, except CAPT and First officer, was found to be extremely small and compact There was no table available to keep your belongings, to have a meal or to work on There wasn't any designated space or standstool for suitcase, thus it had to be left on the floor, which took away the little space available to walk around the bed The bathrooms were very small and compact It was quite difficult to find a space to keep your toiletries as there was no counter top in the bathrooms At least 6 crew, including my self, did not have hot water in the shower or wash basin taps Internet services, thus not considered essential, but helps to complete any left over reports and VRs from flight, was very poor and kept disconnecting on and off",Equipment,,905
"Excellent performance      He is extremely motivated to work and help people   Before boarding he did organize all the bars by placing mix minerals inside Prepared the juices, tea and coffee   Communicated with the ground staff to bring more trash compactor boxes, and follow up on his request  During the service he ensured the galley is clean and tidy Compacted all the trash   I observed him while serving customer He was extremely polite with everyone, noting down their request and delivering as soon as possible  He also used German phrases  Communicated with mid galley, ensuring she has enough juice and water for the We Care  Informed me about number of defects, communicated with the PUR as well when needed  He also has excellent knowledge of the service He knows where are different items in the galley, and the rest of the crew are asking him if they need anything  He will be a great leader",Equipment,,904
"Heading Should Read: Alcohol  Not disruptive  ResolvedCSV Pui Kan Wu   375815   has written a separate report regarding issues regarding customer's meal and seat this sectorI was informed of problem with customer's IFE after initial meal serviceI approached customer, apologised and able to have seat working againHowever during second meal service I was passing through the cabin and found customer seated now in 6BCustomer informed me that he had been moved due to continued issues with his seatAnd that had now found a hair in meal he had been eatingCustomer immediately struck me as being intoxicatedHe was very loudSpeech punctuated by swear words such as 'fuck' and 'shit'Words slurredSeated next to customer at 6D was a mother with a young childShe looked repeatedly across as 6B as he spoke to meAs did gentleman at 6ACrew had observed the mother lean across to speak to 6B at some point earlier",Duty Free Items,,903
"Could not close HHC properly DXB IST DF384   After I printed out the sales summary, I run out of the paper, and needed to replace it Then I chose Turnaround Login So I could not print out closing stock   When I opened HHC for this sector EK124 IST DXB, Even though I sold some items on previous sector, The actual number of the items did not reflect on the opening stock It showed Full stock from Dubai catering   The items I sold on EK123 DXB IST is:   2017 BOH5 Earphones x1   2122 Goof Proof Eyebrow Duo Set x1   2141 Morgan Oates Gradient Floral Peach x1   2048 Morgan Oates Leopard Marine x1   2147 PCardin G Watch, Pens, Wallet x1   2151 Revlon Ultra HD Matte Trio x1   1900 Starwalker Urban Speed Ballpoint Pen x1   2097 TRU VIRTU@ Click Slide Hi tech Wallet x1   1896 Victoria's Secret Scent with Love Fragrance Crayons x1 Those items should be deducted from the opening stock for this sector",Duty Free Items,,900
"My position was L2 DF operator, but instead of signing into DF860, I signed into R1(Lilia Ianeva s420992)'s HHC and cart DF859 by mistake So it resulted in Lilia signing into the wrong HHC and cart DF860 as well Both of us didn't realize the mistake, we both did some sales through the wrong HHC and cart On my side, I sold 2164 9 1964 10 which were taken from DF860 containers in JC galley Also, for sales 2186 6 1963 3 1997 5, I am not 100% sure I took out from cart DF859 or DF860 But for sure 2164 9 1964 10 these two items which are from DF860 were processed as sales using DF859 HHC We realized the mistake towards the end of the flight, so as time limited, we had to close duty free using the wrong set of seals So there is very high possibility there will be missing items in DF860 or even DF859 because we took the items out from the wrong cart and processed with the wrong HHC",Duty Free Items,,886
"HHC terminal no BA01128 transfer out software defective   It was reported by Duty free operator Jeoghun450883, that she handed over physically item no 2057 6 (Fervor Montreal Devine Eye Watch) from her duty free cart no DF398 to another Duty free operator Matej439923 of HHC Terminal no BA0075, and duty free cart no DF397 for the purpose of transfer and sale   Duty free operator Matej processed the transfer in on his HHC and handed the receipt to Duty free operator Jeonghun, however, Jeonghun could not process transfer out on her HHC as there was an error message indicating, cannot transfer a higher number of the item despite only one item being selected   The physical duty free item involved was sold to a customer by crew Matej using his HHC, however, it remained reflected in Jeonghun's Closing Stock in HHC BA01128 as the transfer out in the HHC did not process successfully",Equipment,,886
"Following behaviour we're observed  Communicated with CSV Kristina regarding Greta's performance the previous sector, Csv Kristina stated her flight performance was outstanding After flight review was given by CSV Kristina Golubic (420496) for the DXB HKG sector, change of behaviour was observed During her We Care schedule, cabin crew Greta was prompted regarding clearing the cabin with cabin tidy bags Greta questioned Why do we need to clear the used cups, it can be done with the next crew who will do the next We care schedule?  Before Lunch service started,  I mentioned to crew that to wait a little bit in putting hot water in the towels because meals still heating for 10minutes Greta stated Why don't put the hot water now so it could be ready after 10 minutes After the lunch service, Greta was observed wearing plastic gloves in both of her hands while clearing trays",Duty Free Targets,,881
"Upgrade related issue     On board customer claimed that he requested for an upgrade to the ground staff and they said no vacant seat in JC  Customer was travelling with his friends and one of them was gold skywards member and we upgraded him by using his miles  Customer also claimed that he requested for an upgrade before his friend who was upgraded to JC  Customer wanted to use his miles to upgrade, but he didn't had enough mile to upgrade  When offered his requested SPML AVML he claimed that he cancelled it  When crew member requested to wait to cross check the available meal to offer, customer ask the crew are you forcing me to eat this meal  During the flight customer complaint that he is not able to rest due to the lavatory flush sound  Customer took his AVML meal for breakfast   No further complaint or concerned was raised by the customer during the flight",DF not done,,875
"Cabin Crew Qing Yu (s427746) has signed in my HHC from DF cart number 859 She thought 859 was her DF cart So automatically i signed too into the wrong HHC 860 We both realised the mistake at the end of the flight,when i have already closed my DF cart with the wrong HHC and automatically wrong seal numbers  During the flight the only sale i have made i took the item from DF cart 859, drawer 2, Item number 2142 Swarovski Crystalline Pen So my Sales Summary is actually for DF cart number 859 not 860 The problem is that the other Crew Member is not sure from which DF cart number she was taking the items that she has sold So according to Sale Summary there will be missing product in DF cart 860 for sure and maybe 859 as well if she has taken any items from my cart All from my side is that i used the wrong HHC but the sale i did is from 859 and i sealed 859",Duty Free Items,,863
"Towards the end of the main meal service Crew brought to my attention that Customer was asking for many   drinks(Whisky with coke) during and after the service He was served almost 6 times with the same request He was observed gulping down the drinks as soon as it was given to him Customer was moving from his seat(original seat number 30A) many times causing discomfort to other customers on same row Later crew informed me that he came to J class cabin and started opening hatrack Also CSV Rachael informed me after I came from my break that he had 02 matchbox on him , 02 blue pill(medication) and he was holding a matchstick in his hand He also had 02 cigarettes on him The customer on 31E was moved to the last row of Y class on RHS as he was being disturbed  He was also observed disturbing the customer on 31F He also broke the cupholder of seat 31D",Seals,,857
