description,subcategory,,a
"DF cart No 275      Item taken by mistake       L2 duty free operator Sakkiko 437579 took item no 2130 from drawer 11 DF 275 which was R1's container  The sale was made to the customer , Sakiko did a transfer in to her cart  However R1 duty free operator Kahori 319841 was unable to transfer out ,as she had closed the duty free and it was a last minute sale",Duty Free Items,,358
"CUSTOMER CLAIMED HE PAID FOR HIS SEAT AND WANTS A REFUND customer was telling most of the crew members that he paid for his seat but upon realizing that it was not an exit row, the customer is asking for a refund CSV checked the PIL and it did not say that the customer paid for the said seat customer was referred to address his refund claim to emiratescom",Seals,,357
According to previous comments& incidents: I was wrongly adjusted the opening stock for DF 159 The correct opening stock would be; Item 2115 8 Little gravelled Embroidered  nil Item 2112 8 Little travellers Pilot 32GB 1 As the adjusted page didn't show the full name of the items All starts with little travellers and not synchronize with the opening stock,Duty Free Items,,356
"During cabin secure it was noted that crew were not assertive enough to secure the cabin There was no firmness in their approach while asking them to secure seat belts, seats and hand luggage Some customers were left asleep and were not woken up by the crew fearing their reaction I personally went to assist and found many customers asleep and not secured",Equipment,,356
"Customer complained that the service was not good and that his friend seated at 18 F had to wait for his drinks and snacksHe said that the crew were not polite enough and stated that the crew member asked him to wait till she finishes clearing using her cartHe also said that the toilets were messy after take off, and that he didn't want to use the toilet",Duty Free Items,,356
"Duty free magazine loaded on aircraft not matching DF Items         the Duty free magazines in the Seat pockets of the customers for the entire aircraft were the old magazine   the DF carts and containers were loaded with the new, June, magazine items   customers were requesting Items from the old magazine which were not available in the DF carts loaded",Duty Free Items,,355
"Upset Customer    A father and his son where moved next to Mr Cordomi, so the father could be close to his daughter who needs assistance as she is on a wheelchair  Mr Cordomi wasn't pleased with the idea of having a child sitting next to him  Mr Cordomi was not asked to give his seat, however, he decided to move as he did not want to sit next to a child",Duty Free Items,,355
"Customer Feed Back  During the breakfast service, Mrs Brahimi complained about the continental breakfast tray Customer complained about the poor quality of the food, and the yogurt Customer claimed that when she travels on Emirates to other destinations, the food quality is a lot better  Customer complained about not receiving a Kit bag on this sector",Duty Free Items,,353
"Complaint re meal     During the service, the crew were running short of the meal options, so the crew offered the customer a vegetarian meal if he would be happy to have this   The customer accepted to the meal   Approximately 10 minutes later the customer rang his call bell and complained about the meal saying that he did not order a vegetarian meal",Equipment,,353
Duty free not done by R1    Opening seals: B0213792666768  DF Cart: 1073  Couldn't log in HHC for the reason of this device has been unloaded you can only log in with a Bond ID  The opening stock printed paper loaded from HHC is from previous flight (Dxb Kul)  I attempted to count the itemsstocks but found discrepancies  Closing seals: A0154005464748,DF not done,,352
"On my flight EK018 MAN DXB on 27th of May I was a duty free operator on the right side MR3 During counting duty free items in my cart I found that item 2115 in drawer 8 is missing I got two witnesses who checked my count with me 449496 Jieun Kong and 448786 Wai yan fan Duty free cart number DF544 B5338, drawer 8, missing item 2115 Ilya Yatsyn, 454987",Duty Free Items,,352
Customer traveling from SYD via BKK left hand luggage on board and disembarked the aircraft  Customer was trailing with 18A Mr Parmaksizian  During transit both customers in 16K and 18A had left their hand luggage on board and disembarked the aircraft  Security search was carried out and the bags were removed off the aircraft and placed at the doors,Equipment,,351
"IFE Faults in several seats      After take off, several customers brought to our attention that their seats had issues with the IFE screen The seats had different problems  Affected customers were seated in the following seats: 06AB11AB11JK  Some customers had difficulties in using the IFE, since this aircraft does not have the touchscreen function",Duty Free Items,,351
"An item 1881 2 with the original price 24, is on sales in duty free magazine showing the price of 20 The item was sold for 20, however in the machine and the receipt was showing the old price, 24 Since i had a very short time after the flight to catch a flight for my leave, i did not submit duty free to the cashier As soon as I am back i will do so",Special Offers,,350
"Defective Duty Free Item Refunded  The customer purchased item no:2097 True Virtue Hi tech wallet from Duty Free cart number 908, but upon opening the item, he found it to be defective  He placed his cards in the wallet and was unable to remove the cards  He managed to remove them with a tweezers  He decided he wanted to refund the item due to this",Duty Free Items,,350
CHOICE UNAVAILABLE  Mr Sankar is upset that he did not receive his AVML When delivering the tray crew Esther ran out of choice of meal and informed him that she will be right back with him He claimed that he has ordered it and should be given the priority   Alternative has been offered to him however he declined it  We ran out of vegetarian options,Duty Free Targets,,350
"Duty Free cart number 342   upon opening duty free cart HHC was inoperative HHC Serial no:ET00953   HHC was giving the Error message of SD was not loaded, SD card was available in device but inoperative   Opening stock was correct and checked but unable to accept this due to the error and HHC not loading Opening seals correct   No duty free sales",Equipment,,348
"Hand held computer were placed in the wrong duty free carts from Dubai Cabin crew Diego s453326 has got DF 953, although closing stock shows DF 954, with seal beloging to DF 953 Crew 453326 has sealed duty free cart with current seals found in its hand held computers's pouch If further information required, do not hesitate to contact crew s453326",Equipment,,348
"FIRST CLASS EXPERIENCE 14 customers in first class, greeted, welcomed, menu offered  some customers ate and some chose to sleep throughout the trip, 2 customers enjoyed shower spa experience  crew regularly checked on the customers offering refreshments and hot beverages  pre landing conversed with all the customers and received positive feedback",Duty Free Items,,348
Feedback  Customers were very upset to see that we were serving lamb sausages and lamb kofta for each of the main meals They voiced their disappointment at not having more selection  Customers traveling onwards to Auckland were again going to be served lamb sausage  This is the third time Ive been given this feedback on this sector within a month,Duty Free Items,,348
"Customer would like to swap seat with her mother in YC for the second service  I noticed there were two customers in one seat on 11A,which were Ms Lott and her mother which was seated in YC,it was during drink service for lunch  They requested two drinks for each of them Ms Lott's mother was lying on the seat for almost 20 minutes since I noticed",Duty Free Items,,348
OLD DUTY FREE MAGAZINE LOADED   Customer seated in 2A requested several Duty free products choosing from the old collection magazine loaded in her seat Customer was informed that the chosen products were not available and a new collection of products was offered to the customer The old collection magazines were loaded in all the upper deck seats,Duty Free Items,,347
"DF977 MISSING ITEMS      Crew member Ms Thi Quynh Hoa staff no 435658 operated as R1, duty free cart no 977   She told that following items were missing from her duty free cart : 1 Drawer 6, item no 2123 Cartier Declaration Perfume 2  Drawer 6 , item no 2057, Fervour Montréal divine eyes 3  Drawer 7, item no 2114, Remover before flight keychain",Duty Free Items,,347
Old Magazine in the cabin   During the duty free service I observed that the magazines in the cabin were from the old collection however the items in the cart were from the new collection   A large number of customers wanted items from the old magazine that I did not have available   Sales would have been much higher had the items been available,Duty Free Items,,347
"Transaction mistakenly processed as cash transaction instead of credit card   refund processed    GR2 Teresa Torres Delgado (s448627) processed a transaction as cash sales by mistake, when the customer actually wanted to pay with credit card   The item was 1905 12 Photofast iFlash drive which cost 410 aed   DF cart: 210, ISR Number: 118098360001",Equipment,,347
"Delivered wrong meal       During the dinner service crew member Adele, staff number 432912, accidentally delivered the wrong meal choice to Mr Mittal Upon delivering the meal, crew member asked customer if he was the chicken and his reply was, yes However, customer stated he was distracted watching a movie and did not understand the crew member",Seals,,347
HHC INOPERATIVE  HHC inside DF cart number 465 was not working Opening seals were A013732408 A013732409 A013732410 Closing seals are EKRS7501004217 EKRS7501004216 EKRS7501004217 Items with nil stock: 2100 (drawer 2) 2010 (drawer 3) 1698 (drawer 4) 237 (drawer 5) 1779 (drawer 9) 2009 (drawer 10) 1949 (drawer 10) 2133 (drawer 11) 1971 (drawer 11),Equipment,,346
A huge discrepancy in opening stock compared with the number of items counted DF no 1076; container 174m1 4m150a4m15024 items in total missing: Drawer 8 had only 13 items   was supposed to be 21Drawer 9 had only 10 items    was supposed to be 17Drawer 10 had only 14 items  was supposed to be 20Drawer 12 had only 12 items   was supposed to be 15,Equipment,,346
"This is to document the inefficiency of the cashiers at arrivals hall Every time of my arrival that I have a credit card slip to return or any foundation bag to give, there is one person available (out of the three booths) and I have howsit all duty free operators to hand over their long lost of sales instead of just handing it quickly to them",Paper Work,,345
"Missing Item from DF 698  Item No2053 3 Naninni Reading Glasses 25 Additional Item from DF698  Item No2051 6 Naninni Reading Glasses 15 Witness crew member  Pratchayanee Mahad, Staff no 392360 HHD Stock number is not adjusted due to accidentally pressing Accept button for opening stock before adjust them  Terminal NoBA01020, ISR No118070710002",Duty Free Items,,345
"EK 308 departing 27th JUN, Hand Held Computer for duty free cart number 608 was not working, Showing message 'ram card problem' The computer turned off power itself and I couldn't start again Opening seal number B023564581023564582 and last seal number couldn't check as I broke the seal and dropped lost But it was attached and I broke the seal",Equipment,,345
"FC CUSTOMER EXPERIENCE Interacted with all the FC customers in order to find out about their overall FC experience and also to check for any suggestionsconcerns FC experience was achieved for all the customers Customers were happy with the product, service, and crew performance  No additional suggestions or feedback received from the customers",DF not done,,345
"FC experience      All customers welcomed during boarding  All customers had a meal during the flight except two, who were offered repeatedly, however declined and only had sandwiches and fruit from the social area  All customers stated to have a pleasant flight except for 1EF, for who I have raised a separate report explaining their complaint",Duty Free Items,,345
"UNHAPPY CUSTOMER      Please note that Mr Mathad, seated at 38A, protested about procedure and the fact that crew had to collect headsets before landing  He stated that we should switch off entertainment system, if headsets need to be collected  When crew offered him to keep his headset, he stated Do I need to tell you? and refused to keep it",Paper Work,,344
"Seal number on the DF carts and In the HHC do not match   Crew Juliana 454757 brought it to my attention that the seals she broke off her DF containers do not match the opening seals in the HHC DF cart 266 Seal numbers in the HHC were B021373919, B021373920, B021373921 Seals found on the cart and containers B021373916, B021373917, B021373918",Seals,,343
"In duty free cart DF1162, computer no 2121298 didn't work it was showing the message ''ram card empty or not valid'' opening seal numbers were b020521163, b020521164 and b020521165 closing seals were missing and than changed numbers of closing seals were: a014982968, a014982969 and a014982970 abc paperwork was done and left in DF cart ek 019",Equipment,,343
"Once we open the padlocks from Duty free, there is no other way to lock the Duty free carts and containers until the end of the flight, which is very unsafe for the Duty free operator to leave his Duty free carts and containers open  the old metal Locker was very useful as we could lock and unlock it as Many times as needed During the flight",Seals,,343
"Customer interested in item 2136 5 with the metal strap as it is shown in the small picture with the travel case He didn't want any other similar item as he was only interested in this one He was unhappy with the fact that the picture is inaccurate with the availability in the cart, and suggested that the picture should be removed or changed",Duty Free Items,,343
NEW ITEMS NOT LOADED   The new duty free magazines were loaded on this flight however none of the new items were The duty free stock corresponded with the previous duty free magazine   Some customers were requesting duty free items from the new magazine that were not available therefore not happy as one customer said it was false advertising,Duty Free Items,,343
"CUSTOMER ORDERED GFML AND SHE DID NOT HAVE IT ON THIS SECTOR    During the flight, Ms Zamagni brought to my attention that she ordered the GFML for the trip and she did not receive it  Customer claimed that she had her GFML on the sector of BLQ to DXB and CEB   Ms Zamagni wanted to make sure that she would have her GFML on the onward sectors",Duty Free Items,,343
"Crew Name: Marcela Sanchez Moreno Staff ID: 433939 DF Cart Number: 672 When I opened Duty Free container I noticed there was 2x Drawer 10 and NO Drawer 11, however the HHC was listing all items for Drawer 11 Sold item 2141 from Drawer 11 to customer which I used from other DF Cart but could not transfer in as HHC already had item registered",Duty Free Items,,342
"Discrepancy between DF magazine and DF carts       New DF magazines loaded on sector MEL   SIN   DF magazine not matching DF carts and containers contents   Carts and containers only have the old items from the old magazine   Two customers in YC asking for 9 new items, not available in carts   Passengers upset because travelling to SIN only",DF not done,,342
CUSTOMER WANTED COMPLIMENTARY UPGRADE FOR HIS CHILD      Mr and Mrs Kureshi requested for a complimentary upgrade for their 8 year old son seated in YC  Mrs Kureshi stated that they are both travelling in JC and their son is the only one in YC  After a long conversation Mrs Kureshi stated that her son is travelling with family members in YC,Special Offers,,342
"FELT DIZZY        Customer felt dizzy as he stood up from his seat to go to the toilet after the meal service  Crew member Andrea was called at the scene, she immediately aske d him to lay flat and elevated his legs   Oxygen was administer to the customer for 10 minutes, which made him feel better  Customer was advice to sit up right slowly",Seals,,342
"Customer upset that her Baby did not get a passenger meal  during the meal service Mrs Tagijeva informed the crew that her baby had not been given its child meal  she was upset saying that her baby does not eat baby food anymore and she would like a proper meal   once she had been given a spare tray, she was very happy and thanked the crew",DF Done Nil Sales,,341
"HHC INOP     HHC frozen on 'saving data' page  Unable to print opening stock  Unable to count duty free items  Duty free operator from previous sector DXB MRU, left note for inbound crew that seals had been changed from original given seals and that she had not been able to log out, however no seal numbers written on note to check  DF 013",Equipment,,340
"Customer changed seat and the requested meal was offered to a different customer During the service, Mr Nandha stated that he had requested a special meal, Asian Vegetarian Customer informed the crew member that he had changed the seat, but unfortunately did not inform anyone The customer requested meal was offered to one of his companion",Duty Free Items,,340
"Bag fell on customer on previous sector    At TODseatbelt sign on for landing, customer approached me and claimed on her flight from MNL to DXB a passenger suitcasecabin bag fell out from the hatrack and hit her on the head She asked me to see if her head was cutbruised Customer informed me she had taken her own medication for pain relief",Duty Free Items,,340
"OLD DUTY FREE MAGAZINES WERE LOADED IN BUSINESS CLASS   The duty Free magazines that were loaded in business class on this flight, were the old magazines   Current magazines were not loaded in business class   Due to this issue, the items loaded in the duty free carts were different, compared to the Duty Free magazines in the seat pocket",Duty Free Items,,339
"Customer rubbing and touching his private parts during cruise   Approximately 45 minutes to Top Of Descent cabin crew Amaal Haggag staff number 414540 informed me that customer was behaving suspiciously She stated, every time she walked pass his seat he looked like he was doing something and his behaviour changed as she walked passed him",Seals,,339
CUSTOMER ILLNESS Customer Louise Priol  originally seated at 36B boarded unwell  Customer is 6 years old and threw up twice before boarding  Mother boarded with a red bucket of vomit and informed me of what was happening  Customers were previously on the NCE DXB flight  Mother advised that the child only fell ill shortly before boarding,Duty Free Items,,338
"Items in Duty Free Cart Not Arranged According to the Duty Free Magazine   GR1 Aratrika Bhattacharya, s411402, reported that she had a hard time finding the Duty Free items requested by the customer as the items in the duty free cart no 659 are not arranged according to the duty free magazine issue 45 or the opening inventory paperwork",Duty Free Items,,337
I was a Duty Free operator on the flight ek 078 NCE DXB I sold the item 1012 12 During the transaction my DF computer stopped working and did not print original receipt for the transaction I logged in again and reprinted receipt I asked customer to signed new reprinted receipt I left that receipt in DF counter together with a paperwork,Paper Work,,337
The HHC inside DF cart No561 did not read credit cards Several different cards were tried and none of them were recognized despite swiping in multiple directions with different speed etc Those same cards were tried with a different HHC from another DF cart and there they worked fine indicating the fault was in the HHC and not the card,Equipment,,336
ITEM MISSING     I counted all items in my duty free cart and containers DF374 and I discovered 1 missing item in drawer n1 fervor montreal bangles item code 1692 (360 dhs)  I confirmed with the DF operator of the previous sector DXBACC during disembarkation and she confirmed to me that there was no issues with her cart LHS out of DXB,Duty Free Items,,336
(Please disregard the last subtitle)  Customer purchased item number 2097 Tru virtue click side card protector using the credit card  The item did not work so he asked for a refund  He had initially used his credit card to purchase the item  The refund was fully done to his credit card but on the sales summary it came as a cash sales,DF Done Nil Sales,,335
"DF item 2115 8 missing and item 2183 5 box slightly damaged It was observed by the previous DF operator that item 2115 8 was not in the drawer, although it said differently on the Opening stock   in fact, the item 2112 8 was missing on the opening stock list but it was found in the drawer   item 2183 5 has one of the corners damaged",Duty Free Items,,334
"Seat Socket Inop   Mr Anthony informed crew member Ali his socket cannot charge his laptop After several trial , crew member Ali suggested to him the availability of a vacant seat in 8A however seat mode controller does not work Mr Anthony requested to sit in 8A as he only wanted work He later during the flight went back to his seat",Duty Free Items,,334
DUTY FREE MAGAZINE                            NEW MAGAZINE LOADED BUT NOT ALL ITEMS LOADED ON BOARD  PAX AT 11G REQUESTED TWO ITEMS WHICH WERE NOT AVAILABLE ITEM NO2148 11 PAGE 56 AND 2147 7 PAGE 66 IN NEW MAGAZINE  ITEMS IN MAGAZINE THAT WERE AVAILABLE WERE NOT LOADED IN THE CORRECT DRAWERS AS PER THE DRAWER NUMBER ON THE MAGAZINE,Duty Free Items,,333
Inflatable pillow    During cruise Ms Peluso was observed using a big inflatable pillow to rest her legs as she was seating at the emergency exit at L3 door (24 C)  The customer was informed that no lose items are to be kept at the emergency exit at any time  Ms Peluso stated that this is the first time that she is informed of this,Duty Free Items,,333
"Customer made various requests during flight   Customer showed ID to crew upon boarding, claiming she worked for another airline and was cabin crew Customer asked three different crew to see the CRC All three crew declined the request She said to crew Anastasia that is not nice Customer asked for a big bottle of water during cruise",Equipment,,333
Customer unhappy as she didn't get her meal choice    Mrs Whitehead was upset when Cabin Crew member Nicole mentioned that she doesn't have the Lamb choice and asked her for her 2nd choice  She mentioned that she paid thousands of pounds for her ticket and its unacceptablePS: Please make sure she gets her meal choice on this sector,Seals,,333
Customer upset with promised upgrade by ground staff      During boarding customer told me that she had been promised an upgrade by ground staff and that nothing was arranged for her in the end  Customer was displeased and stated at least twice during the flight that the customer service on Emirates has gone down over the last year,Duty Free Items,,333
"Today 5th of June I was operating duty free on DXB DUB flight EK 163 Wen it was time to close and seal duty free ,by mistake I sealed the card and the containers with the metallic seal Card number : 042 Metallic Seal no 7501054608 Container number :206A Metallic Seal no 7501054606 Container number :207AMetallic Seal no 7501054607",Seals,,331
"SEAL NUMBERS IN HHC DO NOT MATCH WITH SEAL PRESENTS   DF 403 HHC seals numbers were: 7501092556, 7501092557, 7501092558 Seals present in the cart had the numbers: 7501092553, 7501092554, 7501092555   DF 404 HHC seals number were: 7501092553, 7501092554, 7501092555 Seals present in the cart were: 7501092556, 7501092557, 7501092558",Seals,,331
"Shortage of several products  Only one regular espresso pod left for this sector, the rest were decaf  Shortage of eye shades and socks Shortage of green tea  No toothpicks in the Amenities  No garnish for the main courses  Shortage of nuts for the main service  No olive old and balsamic on the trays, one customer requesting them",Equipment,,331
DF CART 346 HHC NUMBER NOT READABLE  COMPLIMENTARY RECIPT WAS ACCIDENTALLY PRINTED    Cabin Crew Mohamed Abdelbaky 419600 was doing Duty Free:   He was very curious about the new HHC and Its new function:   He accidentally pressed an Item and tapped P and choose complimentary:   He then pressed Yes:   The HHC printed the recipt:,Equipment,,330
"In flight Illness Nose Bleed   MrMohammed aged 15 suffered a nose bleed, as claimed by the mum the kid has suffered with this since a baby including the dad and younger brother plus when he eats spicy food  After the first 10mins of pressing the forward part of the nose, the bleeding stopped with a slight amount of cleared fluid",Equipment,,330
"Customer did not receive meal on time crew member marco was serving mr caleb,but he ran out of the non veg option so he asked mr caleb to wait while he comes back with the mealSo marco kept the tray and left there was no non veg option left it took some time to come back with the meal ,so mr caleb got upset and refused the meal",Duty Free Items,,329
"RE : Final closing of the Duty free  At the beginning of the 2nd service   Lunch Service was about commencing, when the customer requested to purchase the Duty Free items, she mentioned that she had closed the Duty Free assuming that no sale for the flight  Megan had closed the Duty Free in advance without informing the senior",Seals,,328
EK 0381 HKGDXB SECTOR THE DUTY FREE IN MAIN DECK WAS DONE BY Crew taking the magazine in the cabin to take the duty free orders from the customers  As the Aft cart lift was jammed There was only one cart lift in this AC and crew were unable to take the upper deck duty free cart to main deck to do duty free service in the cabin,DF not done,,328
