description,subcategory,,a
"INCORRECT SEAL NUMBERS             Seals on DF cart and containers DF452 different from what the HHC showed  Seals on cart and containers: 4015965189, 4015965190, 4015965191  Seals according to HHC: 4015966189, 4015966190, 4015966191  HHC ID:",Seals,,242
"Customer Seated In Incorrect Cabin Customers boarding pass showed 40D Customer sat at 1E and failed to inform any crew of his wanting to upgrade Cabin supervisor Makram, after welcoming his customers back, realised there was an extra customer",Duty Free Items,,242
Baby Bassinet  Mr Cha requested for baby bassinet but the baby was over the height limit and (Over 72CM) so cabin crew did not provide the baby bassinet and  arranged some extra seats to help them having more space as they have three children,Equipment,,242
Mrs Almomin appeared not happy as she requested to get a baby bassinet for her child which is child can't fit inside baby bassinet as its too small for him  Mrs Almomin claimed that she had the baby bassinet on her pervious flight on Emirates,Equipment,,242
Customer fainted in seat   Customer felt faint and informed crew via call bell  Customer had not eaten since 9am local time (MLE)  Was slightly unresponsive but regained consciousness soon after   She was travelling with partner seated at 32A,Duty Free Items,,242
DF item number 2080 Elie Saab Girl of Now perfume from drawer 05 was transferred out from DF Cart number 459 to DF Cart number 460   Only one item was transferred out but the other duty free operator 450654 accidentally transferred in 3 items,Duty Free Items,,242
Customer got champagne spilled on his jacket during the welcome drinks service   CM Andrea accidentally spilled some champagne on Mr Moraoviedo during the service   customer got upset and gave the jacket to Andrea and demanded her to clean it,Duty Free Items,,242
"Towels Not Completed      We encountered moderate turbulence during the HB service and were asked to remain seated until cleared for duty, so therefore towels were not completed  Priority was given to cabin securing in preparation for landing",Seals,,242
"New Seals Trial    It was observed that upon sealing DF cart DF823 into DXB, we were unable to put the seal properly into the hole located on the cart  The seal was not properly fitted into the hole and it became challenging to lock the cart",Seals,,241
"Missing item, DF 922 (2110 5), Little travellers key chain   Open stock summary indicates 20 items in drawer 5, but there are only 19 items   There are supposed to be 2 items with the code 2110 little travellers key chain but there is only 1",Duty Free Items,,241
"Item number 2109, the Airbus A380 replica feedback from customers  Few customers requested to tee the item, and returned it stating that the replica is too small  All customers stated that they expected and would like it to be bigger in size",Duty Free Items,,241
"item missing      Item 1964 Ultra Facial Cream by Kiehls missing when counting opening stock, drawer 11 from cart number 039   Should be noted that 2 closing seals were missing and one did not match the paperwork left by previous crew member",Duty Free Items,,241
"All customers were greeted and shown to their suitesThey all had Dom Perignon champagne after take off with nuts or chipsThey all had food during the flight They all highlighted the proactivity of the team, their attentiveness and positivity",Duty Free Items,,241
"Teamwork                 For this flight, a Gr2 crew was allocated the duties of UL1 due to FG1 calling sick  Sanaa Glaoui sn395930 accepted the challenge and seen to be training the Gr2 Alen Bogiv sn451771 for the FC service style and tasks",Duty Free Items,,241
"HHC inoperative  After turning on the HHC, the following message appears This device has been unloaded You can only log in with a Bond ID DF Operators were unable to use the HHC This affected both R1 and L2 devices Serial no: ET00865ET00918",Equipment,,240
"Malfunction of HHC     Ivana Matic, s405128, opened her duty free cart 308 and found that HHC, 00906, is malfunction for her cart   It showed a message as below, Error ' Database prepare failed  database disk image is malformed' in function",Equipment,,240
"Totally 20 items missing in Duty free cart DF1090 Including: Item No 2117 from Drawer 03 Item No2024, Item No2091, Item No2025, Item No2025 and Item No1967 from Drawer 04 Item No1588 from Drawer 05 Item No2076, Item No1903, Item No2095, Ite",Duty Free Items,,240
"Incorrect Duty free magazines loaded at the seats  Please be advised that we were loaded with duty free carts loaded with new items according to the new duty free magazines, but at the passenger's seats we had old duty free magazines placed",Duty Free Items,,240
"I, Alla Chaika (447052) was doing Duty free on AMS DXB sector and during the flight I didnt make any sales While I was closing my DF  591 I printed only logout summary and HHC run out of battery I didnt print closing stock and sales summary",Paper Work,,240
Seals changed due to error on the containers    Alexander 431582 sealed DF506 with two metal seals by accident   One container is missing one metal seal   Container DF506 has been sealed with a green seal A015538238   No DF item was missing,Seals,,240
Crew could not count the opening stock The HHC is not working A few crew tried to reset many times but nobody could fix it message showing DataFlight AS and Error on the web server or bad internet connection appeared Shut Down was displayed,DF not done,,240
"FOOD SHORTAGE  Passenger Load : Full 400  Flight Time : 15 hours 40 minutes  After 10 hours into the flight we started to run out of water, diet coke and pepsi and the as you like it we care snack basket which contains fruits and chocolates",Seals,,240
allergy   Mrs Thomas advised crew during special meal delivery that Dr special meal contained a kind of fish that she is allergic to as per special meal uploaded from LOS Customer was offered alternative meal from main menu which she agreed,Duty Free Items,,240
Meal Choice Unavailable (Omelette)      Please be advised that majority of the customers travelled on this sector were foreigners (tourist)  Customers declined to have the Mutton Curry  Meal percentage was: Mutton Curry 60% and Omelette 40%,Duty Free Items,,240
DF cart number 201 wire seal broken after landing into Dubai  Seal number 7501062708   Reason for breaking the seal is due to last minute selling of item to pax and I thought I might have left the money inside of the cart before closing it,Seals,,239
DF WAS NOT CLOSED AND SEALED   Crew member Jean 414223 forgot to close his dutyfree No 094 in the flight from DXB to LYN   He did not close the flight on the HHC and did not seal the cart and the two containers with the closing green seals,Seals,,239
DF operator on this sector (DF110) I accidentally entered the wrong watch reference item when I proceeded with the sale Gave to the customer items No2189 11 and No2136 5 (the ones he wanted) BUT Sold these two items; No2145 10 and No2136 5,Duty Free Items,,239
"Customer requested item 2069 11 from DF596   Upon viewing of item, customer discovered that item had damaged appearance   Customer wanted to purchase item, but requested another one   Item description: Haus of Dietrich Park Avenue Bracelet",Duty Free Items,,239
Handheld Computer       DF Cart 1061   SD Card Label UAE6110   ISR  118042670002   Closing Seals 7501079827  28  29   HHC  ET00701 was not placed back inside duty free cart   Cart  containers contents were checked and inventory was correct,Equipment,,239
DF metal seals swapped   1 red metal closing seal from DF981 (seal nr7501094933) used on a container from DF982 1 red metal closing seal from DF982 (seal nr7501094930) used on a container from DF981 Duty Free operator DF981 S451205 Joachim,Seals,,239
Could Not Connect To WIFI Final attained on my kis tablet Netgear switched on and connected to MOD's from two GR1 crew pulled out from flight could not connect to WIFI Seat map could not be used as Connect to WIFI icon could not be changed,DF not done,,239
"SUSPECTED FOOD PPISONING    During boarding, I felt discomfort and had to used the toilet   It was the start of diarrhoea and during the flight, there were 6 more episodes of diarrhoea  Stomach cramps was also getting closer in frequencies",Duty Free Items,,239
Approximately 4 hours in to the flight Mr Youssef approached cabin crew complaining that he feels sick and that he vomited once in the toilet  Mr Youssef felt better and slept for the rest of the flight  Mr Youssef walked of the AC unaided,Duty Free Items,,239
"cleanliness of original seat      Mrs Fiona Kalkman felt that her seat was a bit damped, I thought that on the previous flight the customer sitting there got sick  Mrs Kalkman did not want to sit on that seat and requested for another seat",Duty Free Items,,239
Customer 9E feedback             Customer sitting 9 E Mr Osama Salamah ((971503228244) insist to leave his contact because in case you want to confirm about crew performance) he wants to say thank you for the whole business class team   He,Duty Free Items,,239
Item 2066 Roja Elysium parfum cologne from drawer 9 of duty free container 435 is stated under nil stock however the item is available   Crew member noticed extra item while counting duty free   13 items available instead of the stated 12,Duty Free Items,,238
"HHC ET 00754 HHC was not printing full receipt details, due to a suspected fault in the HHC itself Witness: PUR Johnny 382020 DF cart  828 Full details of the sale, was written on the back of the receipt and was handed over to the cashier",Equipment,,238
"When turning on hand held computer for DF cart No: 1029 it was noticed that the RAM memory card is not inserted    Also some items are missing , they are documented in previous VR    After inserting back the RAM , computer started working",Equipment,,238
HCC number 2120496 was not working (printer defect)  Duty Free number DF196 cart and containers counted manually  2 items are missing :  2099 from Drawer 1 (Swarovski Elumine Pierced Earings)  1630 from Drawer 12 (Ladies Gold Ingot Watch),Equipment,,238
"Crew member Ileana Maria Aron, staff no419483 was missing duty free item from Cart no 128, drawer 7, item no 2108 (Engino 12 in 1 Aviation Model Set) CSV Marcus (414851) watched as I open the cart and containers and witnessed the counting",Duty Free Items,,238
"Crew member Ileana Maria Aron, staff no419483 was missing duty free item from Cart no 128, drawer 7, item no 2108 (Engino 12 in 1 Aviation Model Set) CSV Marcus (414851) watched as I open the cart and containers and witnessed the counting",Duty Free Items,,238
Ms Pukhteyaeva is traveling with a baby and she was observed breast feeding  She asked for wine in the mug Crew double checked since she was breast feeding and she confirmed that she really need alcohol  She served 2 times wine in the mug,Equipment,,238
"Bad Weather      Due to bad weather, the cabin crew was asked to sit down for 5 inutes for safety reason  Tea and coffee was not done as it was not safe to do so  Captain informed that the turbulence will last for approximately 45 minutes",Seals,,238
Duty Free Cart Number 157:  During pre flight check of DF 157 the padlock was missing from the cart and when opening the cart for count the opening seal was different from the one logged in the hand held computer;  No items were missing;,Seals,,237
"DEFECTIVE ITEM, SOLD AND CHANGED     Note that item 2137 3 (Emirates 3 in 1 charger), sold to a customer in Y, was defective   Customer realized when he opened it to use it after the sale   One piece from the I phone plug side was broken",Duty Free Items,,237
"DF 570  20% off offer was not calculated on HHC  1 customer bought 3 creed perfumes, manually given 20% off, using Emirates In Flight Sales Voucher (card payment)  another customer bought 1 creed perfume manually given 20% off, paid cash",Special Offers,,237
2 Items missing from drawer 9 and drawer 10 in DF003                                                                  2 Items 2164 CH Good girl velvet Fatale missing from drawer 9  1 item 1974 Anti  Radiation Patch missing from drawer 10,Duty Free Items,,237
2 Items missing from drawer 9 and drawer 10 in DF003                                                                  2 Items 2164 CH Good girl velvet Fatale missing from drawer 9  1 item 1974 Anti  Radiation Patch missing from drawer 10,Duty Free Items,,237
The aircraft was loaded with the new duty free magazine however both duty free carts for L2 and R1 was loaded with the items from the old duty free magazine Hence passengers were very upset because the items they wanted was not available,Equipment,,237
"hand held commuters    ­  hand held computer was used to open the flight Duty Free hand held computer froze after and wouldn't print out opening stock count Duty free number: DF621 Duty free seal number: A015931478, A01593179, A01593180",Equipment,,237
"Item no2034 Buckley London XO Bracelet Set of 3 shown as NIL Stock, however, the item was found in drawer 9 in DF1131 container   DF operator tried to adjust the stock, but it couldn't be done since the item hasn't been registered in HHC",Duty Free Items,,237
Duty free item    2132 Dyrberg Kern Travel Fairy Tales Bangles After selling Duty free Item Customer informed the duty free operating (L2) that the item was damaged As there was not a second item to exchange Customer was offered a refund,Duty Free Items,,237
"Due to airport construction, we have boarded our customers via remote stands from L2 and L5 doors Both stations were extremely cold and windy with 5 degrees Centigrade The CSVs were going to be extremely cold while boarding our customers",Special Offers,,237
Customer claimed service was slow and it took him more than 1 hour to get his food Customer ate his starter then told crew it took too long for him to get his main course He told me that if he was in a restaurant he would have walked out,Duty Free Items,,237
Not enough social area items loaded   2 baskets for social area were loaded on a 16hour flight Customers loved to walk around n eat from the baskets However not enough fruits and chocolates were loaded Baskets became empty in a few hours,Seals,,237
Duty free cart number 1065   Item in excess 1978 PC ladies watch and jewellery set drawer number 5   Item number 1989 mom YSL mon paris EDP 900ml drawer number 7 the plastic cover was open (not excess item)   Returned item to its drawer,Duty Free Items,,236
HHC inoperative       Duty Free card number 046; HHC is not operative   Crew managed to log in and accept the items counted however opening stock can not be printed   Hence crew can not log off either   HHC message (error session on RC),Equipment,,236
"Asthma Attacked  During the flight Mr Jain asked for an Oxygen  He has previous history of Asthma, Diabetes and Low Blood Pressure  Dubai Time: 1110 hrs   78 SPO2, 1115 hrs 82 SPO2, 1120 hrs 85 SPO2  MIRF  337864  Mobile No 919466331451",Duty Free Items,,236
Changed Seal Number One of the actual duty free seals did not match the number recorded in the system Seal number 020479122 was not recorded in the system Actual Seal number as follows: Duty Cart 239   020479122   020496547   020496548,Seals,,235
"I was R1 But since I was the only FG1 and it was a full cabin both ways, I did not have time to open count Duty free hence DF Cart 1095 & both containers still have White Seals into DXB seal numbers are B022048546 B022048547 B022048548",DF not done,,235
"I was R1 But since I was the only FG1 and it was a full cabin both ways, I did not have time to open count Duty free hence DF Cart 1095 & both containers still have White Seals into DXB seal numbers are B022048546 B022048547 B022048548",DF not done,,235
DF 671 (Two missing item)   Opening seal no From LOS : A015869911  12  13   Detail of Missing items Drawer no : 12  Item name : Hermes Cologne Collection Nomad Set ( AED 360   99 )   02   Witness by Crew member Ms Irina Fedko (s413105),Duty Free Items,,235
"Found a Missing item 2115  8 Emirates Stickers Patches DF1139 when I amended HHC opening stock , I made a mistake to put  2112 8 Little Travellers Pilots 32GB as a missing item ( but it is actually there )   Witness crew  421169 Sameer",Duty Free Items,,235
Duty free items nr 2115 Little Travelers Embroiderer 1945 Transonic Card Guard missing from drawer nr 8 While adjusting on HHC in the Opening stock accidentally pressed item nr 2112 Little Travellers Pilot 32 GB missing instead of 2115,Duty Free Items,,235
"DUTY FREE DONE NO SALES  Crew members Parisara Narawudthikul Staff number: 386181, Michelle Troccoli Staff number: 388282, Victorina Okumu Staff number: 412403 and Yoonhee Kim Staff number: 448577 made no duty free sales on this sector",DF Done Nil Sales,,235
HHC battery run out before I was able to finalize closing duty free I was able only to print copy for the cashier No personal copy was printed or closing stock Other duty free carts was already closed so I couldn’t borrow the battery,Equipment,,235
"During the physical inventory count of duty free bar number DF1022 following items were found missing; 2147 PCardin (G) watch, pens and wallet (x1) 2022 Timex time machines youth watch (x2) Total of 3 items missing from drawer number 7",Duty Free Items,,235
"On the flight ek504, crew Mengmeng Jiang staff number 435516 found a missing item in her duty free cart df900, drawer 10, item number 1964,ultra facial cream by Kiehl's  Witness crew Ahmad Omara staff number 426834 item adjusted in HHC",Duty Free Items,,235
"The item Misfit Shine 2 ,from the DF cart 501, with code 1934 was excess in drawer no8 According to the opening stock summary this specific item was shown as nil Moreover it was not possible for the operator to adjust the stock number",Duty Free Items,,234
"DUTY FREE TRANSFER OUT NOT DONE   Item 2145 Drawer No 10, handed over from DF 131 to DF 132   Transfer in done in HHC in DF 132   Transfer out not done in HHC in DF 131   DF cart 131 operator : s432889   DF cart 132 operator : s432125",Duty Free Items,,234
"DUTY FREE TRANSFER OUT NOT DONE   Item 2145 Drawer No 10, handed over from DF 131 to DF 132   Transfer in done in HHC in DF 132   Transfer out not done in HHC in DF 131   DF cart 131 operator : s432889   DF cart 132 operator : s432125",Duty Free Items,,234
WRONG REGISTRATION  DUTY FREE CART 348       Crew member Iuliana Popescu s453081 brought to my attention that when she printed out the paperwork; the wrong registration was mention on the print out A6 EOC   Our registration was A6 EDC,Paper Work,,234
Customer complaint regarding meal  The customer was upset as there was a hot snack in his KSML that was not heated  The heating of the snack was overlooked because as per the service routine 1 there are no hot snacks served in Y Class,Seals,,234
"on a Boeing 777 aircraft, the compartment M215 (where the  Holloware container is stowed ) always gets very warm due to the espresso and coffee machines situated underneath ; all the contents of the container are getting warm as well;",Equipment,,234
Mr Eldebri confronted customer seated in front of him  Customer seated at 73H complained to me that Mr Eldebri is not allowing her to recline seat  Mr Eldebri stated that he does not feel comfortable when scene is to close to his face,Duty Free Items,,234
customer did not receive his request VGML     customer moved seat and did not claimed for his VGML when crew offered his lunch during the service customer claimed to the galley and asked us if he would received his VGML on next sector,Duty Free Targets,,234
Closing stock seal numbers:  4015351401  4015351402  4015351403  Two of these did not match the actual seals on the containers after I opened duty free  Counted DF and found item 1948 from Drawer 11 missing  Witnessed by crew Antoine,Duty Free Items,,233
"While counting my duty free cart number 494, I realised the following items were missing although they appeared on my opening stock 1 1957 4(1 Million Prive EDP 100ml) 2 1698 4(Black Orchid EDP 100ml) 3 1854 7(Lancome La collection))",Duty Free Items,,233
"Paid seat  Mr Lindstedt, initially seated at 41K, claimed he paid an additional 80euros for a window seat with legroom however, when he boarded, he said that his seat did not have a window and asked to be moved to another window seat",Equipment,,233
Customer Torn The Survey Form   Crew member informed me that when she asked the customer to return the survey form Mr Mitchell torn the survey form as he said he did not want someone to get into trouble because of what he has written,Equipment,,233
broken earphones  While doing meal service customer's personal earphones were dropped on the floor While passing with cart crew pushed it over the earphones and it got broken  Crew member did notice the earphones as it was very small,Equipment,,233
Customer preferences    customer's father MrQaiser Abbas (4K) requested customer to be removed from the child list (meals  please assist with this request for future flights  as unable yo amend through customer profile as a skysurfer,Equipment,,233
DUTY FREE ITEM MISSING                     Whilst counting opening stock from DF 099 Item 2097 01 were missing   Prior to opening the cart noticed that the seal were broken seal Number: 388379   Crew Member : Sara S 445650 witnessed,Duty Free Items,,232
"Duty free operator Sofia ( 397301) informed me that she had a few duty free requests from the new selection in the magazine from the Customers However, she was not able to meet these requests as the items are not loaded In the carts",Duty Free Items,,232
HHC not calculating the 20% discount  Cabin crew Denitsa( 456440) sold Item 2023 7 from duty free cart  666 Item original price 96 USD HHC didn't calculate the special offer(20% discount) crew Denitsa sold the item for 96 08 768 USD,Special Offers,,232
"The hand held computers in duty free carts (DF 185 and DF 186) were accidentally changed on previous sectors Current duty free operators Andras Keri (s439418) and Chanukah Thepruangchai (s455924) logged in , and realised the problem",Equipment,,232
Duty free cart 1164; Duty free Operator Yaacoub Abi Hachem 412924 2 seals out of 3 not matching: Seal numbers on handheld: 4015 862 961; 4015 862 962; 4015 862 963 Seal numbers on cartcontainer: 015 862 959; 015 862 960; 015 862 961,Seals,,232
"Extra item  When counting the opening stock, crew member Hatem (staff 455528) found one extra item in drawer 12 Item 1683 was supposed to be NIL, but actual stock was 1 DF cart  1002  Witness crew member was Emmanouil (staff 397353)",Duty Free Items,,232
"Kindly disregard the category  Flight was operating with 2 CSVs as GR1s (not having DF pouches available);  No FG1s on the flight;  Flight operated as 2 class on a 3 class ac, hence only 1 crew member in premium cabins had DF pouch;",DF not done,,232
"Kindly disregard the category  Flight was operating with 2 CSVs as GR1s (not having DF pouches available);  No FG1s on the flight;  Flight operated as 2 class on a 3 class ac, hence only 1 crew member in premium cabins had DF pouch;",DF not done,,232
Duty Free Missing Items: Df cart number 490 IRS 118104600002 Drawer 4: 1698 black orchid perfume 2166 DG light blue perfume 2090 tommy Hilfiger Tommy edt 2073 tommy Hilfiger girl EDT Drawer 7: 1524 aviator watch 2065 ted baker watch,Duty Free Items,,232
Duty Free Missing Items: Df cart number 490 IRS 118104600002 Drawer 4: 1698 black orchid perfume 2166 DG light blue perfume 2090 tommy Hilfiger Tommy edt 2073 tommy Hilfiger girl EDT Drawer 7: 1524 aviator watch 2065 ted baker watch,Duty Free Items,,232
Dutyfree containers not sealed  Both Dutyfree containers 1132 were not sealed as I forgot it in preparation for landing and doing my landing duties  Orange seal numbers are D0019136 and D0019137  However the dutyfree Cart was sealed,Seals,,232
"Mr Jenkins enquired about his membership status and his miles  Customer stated that he had done a few flights and when he checked his profile online, it stated that he had acquired zero milesContact Details : davejenkins138@gmailcom",Duty Free Items,,232
VGMLAVML REQUESTS    Around 15 customers approached the crew requesting for VGMLAVML These customers did not requested the above preferred meal due to various reasons  No extra VGMLAVML loaded or returned from the original customers,Duty Free Items,,232
"IFE inoperative    Mrs Fawcus was travelling with 2 sons occupying 38D, 38E and 38F One of Mrs Fawcus' children was occupying 38E which was not operating properly, only 5movies were available, and Mrs Fawcus was not happy about this",Equipment,,232
"Customer and his wife didn't want to take hot meal, since their preferred meal choice wasn't available    During the service, customer and his wife 47J just took the tray, since their preferred meal choice (chicken) wasn't available",DF not done,,232
"An item No:1881 was transfered out from DF443 to DF444 after it was transfered in to DF444 DF443 was closed and I had to open it again and it showed the return sector KWI DXB,but actually the transfer was made on the sector DXB KWI",Seals,,231
DF containers not sealed   DF867 containers not sealed after completion of closing   DF 867 containers was locked with padlocks   DF cart was locked and sealed   Got busy distracted time constraint   Realised once at the crew hotel,Seals,,231
Cabin crew Ivana Kotrcova (453124) was the duty free operator with the duty free cart 989   She felt sick on the flight and was deadheaded   Duty free was not done and only closed with metal seals   Crew did not count the duty free,Seals,,231
