description,subcategory
Customer Feedback    Mr Mukherjee enquired about whether the WIFI on board was free  He stated FC customers regardless of their HV status should be provided with free WIFI throughout the flight as they pay a lot of money for the seats,First Class
Customer Mr Hirtzig paied asked for refund       Customer informed me he paid for 150MB internet in the beginning of the flight   Internet throughout the flight worked onoff   Customer slept and when he woke up his MB had expired   Customer claimed he didn't use the internet during flight,Economy Class
on air WIFI purchased but not working During no coverage time   Mr Barbosa was upset that He purchased WIFI and did not work customer was informed that the air space we were on restricted its function(no coverage zone)   This was apparent because even the live TV stopped working,Economy Class
"WIFI AND LIVE TV INOPERATIVE       During the flight, WIFI and Live TV was inoperative   Upon checking the CabinIFE logbook, deferred page, it was logged that TVINTERNETMOBILE system work intermittently and there's a history for the Live TV to be inoperative",First Class
"WIFI AND LIVE TV INOPERATIVE ON BOARD       Customer claimed that she is not happy with her past flight from DXB BCN (A380) because WIFI and Live TV did not work through out the flight   And today, it's the same problem and she claimed that she initially booked her flight to BEY with Fly Dubai but decided to fly with Emirates instead because of the WIFI and Live TV services   Customer claimed that she is very upset and will definitely not book flights with Emirates anymore   It was logged in the CabinIFE logbook that system works intermittently and there's a history for the Live TV to be inoperative",First Class
GoldPlatinum member can't log in in Wifi   Platinum and gold skywards member travelling in economy can't log in in the on air WiFi  Customers tried to put there skywards number and password but not recognised  WiFi was not working properly during the flight (using non skywards option)  No compliant to customers,Economy Class
Mr Pascualpalma paid 10 USD by credit card for on board WiFi after 2 hours free WiFi He went back to the web it shows 'Something unexpected happened Try again later' He couldn't use the internet which he paid for the rest of the flight,Economy Class
the wi Fi services were INOP throughout the flight,Economy Class
WiFi Refund     Shortly after the dinner service Mr Herbert complained that he paid for the WIFI however shortly after connecting the service disconnected and no longer worked  The customer also showed me a sms he received from his bank for the deduction of the WIFI charges  Reference 38243510,Business Class
"Customer complain while I was introducing my self to the high value customers ,I observed Mr Ali seemed not very happy when I enquired him if every thing was fine, Mr Ali said it 20 min for the crew to get him a can of Pepsi",Business Class
This Aircraft has the facility of InternetVoice & datadata roaming No connection available for internetmobile,First Class
This Aircraft has the facility of InternetVoice & datadata roaming No connection available for internetmobile,Business Class
This Aircraft has the facility of InternetVoice & datadata roaming No connection available for internetmobile,Economy Class
on air WiFi not working on laptop    Mr Felci paid 1599 to use the WiFi on his laptop  Once connected he claimed it did not work,Business Class
Customer unable to connect to WIFI after payment   Customer made a purchase using his Debit card ending with number 4910 for USD 1599 package   The connection was not stable from customer feedback and was barely able to connect,First Class
Customer complained that he paid for the WIFI and it was not working Internet was working intermittently throughout the flight,Economy Class
During cruise Mr Chobdar requested some assistance regarding the wifi connection claiming that he purchased the 500MB internet plan after using all his 20MB free data however Mr Chobdar claimed that he was disconnected and he was given only 20MB free p,Economy Class
Mr Canning informed us that his wife's Aero mobile is going straight to the page where she supposed to pay for internet    Mr Canning told us she didn't use the free data of 20mb So how come it showing the option of paying fir internet,Business Class
customer cannot connect to on air WIFI network using his skywards membership number,Business Class
Customer Feedback    MrsPennycuick enquired if the WIFI on board was free  She was a surprised that we do not provide free WIFI throughout the flight and claimed that Qantas provides Free WIFI to its customers even in Jc by providing a code  She stated it was the basic for Fc customers to be able to get the service without having to pay for it  Customer was not upset,First Class
"WIFI not connected  Shortly after the dinner service, MsSumich called the crew to inform them that she had bought the on board WIFI and claimed that she paid USD 799   She claimed that the WIFI was not connected at all and once it was connected it was very slow  Ms Sumich then showed me the mail which confirmed that she had bought the WIFI on this flight",Economy Class
Customer claimed he paid 15 for the wifi and it did not work     Wifi did not work for some time during the flight,Economy Class
WIFI Working intermittently    due to several complaints from customers in the J and Y class cabin about the WIFi connection being intermittent a reset was done from the ML1 FAP  customers stated that the WiFi was working but was very slow,Business Class
INOP WIFI & AEROMOBILE IN ALL CABINS     Post take off it was found that customers in all cabins could not log onto the wifi   FAP showed that Avionic Data missing and Mobile telephony data missing,First Class
"Customer claims for WIFI refund due to the service not working  Customer was trying to connect to the WIFI after take off however the home page kept reloading and would not take her to the payment page  During the flight after several attempt customer managed to select the 999 plan and connect to the WIFI  However, as claimed by Ms Coles after her payment was accepted the service was down again and she could not use the WIFI at all throughout the flight",First Class
Mr Hasan claimed that he purchased wi fi on board 500mb around 2 hours prior landing and it didn't work at all after few attempts to connect,Economy Class
Customer complaint  Customer complained that the on air WiFi was not working,Business Class
"WiFi connection  Customers informed crew that when they press Continue on the on air browser page, its stalling",Business Class
On board WiFi    Customers in Y class were upset since aero mobile didn't work,Economy Class
"Intermittent service, customers upset:   Wifi was very slow throughout the flight and kept giving faulty signal on FAP   Many customers complained specially the ones who paid",Business Class
WiFi & live TV service were not available throughout the flight,First Class
Wi Fi INOPERATIVE       Wi Fi Inoperative during entire flight   Defect already on deferred logbook page since 080618   Message sent via CMT to DXB engineers   Reset performed several times No Positive outcome   Customers disappointed about issue,First Class
Customers were not very happy with the wifi signal or that Live TV was not on board during a world cup match,Business Class
"JC Customer claim of non providence of paid Wi Fi services  Customer has claimed that she attempted to connect her laptop and mobile phone to the Wi Fi services, and has paid for 500mb service with her credit card, and was unable to connect through the majority of the flight duration  Multiple attempts were made to connect the customer's Personal electronic devices to the Wi Fi services, and this were verified to be constantly delayed  Customer was the only customer claiming to have difficulty establishing connection to the Wi Fi services  Customer details not provided",Business Class
"Customer purchased 10 Wi Fi and didn't work after phone reset    During the flight, customer informed me that he purchased 10 Wi Fi however after resetting his phone his Wi Fi didn't work anymore even though customer claimed he hasn't used the whole data",Business Class
Mr Muzyka paid for 150Mb It did not work during the entire flight Only started working 1 hour before reaching Dubai,Economy Class
Customer paid for WiFi services     Mr Deepak claimed to be a platinum member ( ek 124300794)  He stated that on todays flight he could not access the free WiFi service with his skywards number  Customer paid to use the on air WiFi,Business Class
"Customers in ALL cabins commented their internet did not work    While going through between Kuwait and Iran Airspace, some customer stated they could not connect onto the internet,  Later on going through Turkey the same issue occurred",Economy Class
WiFi and live TV inoperative    Upon reaching the aircraft in Dubai and checking the cabin log book I found that the WiFi and live TV was listed as inoperative,Economy Class
issues with WiFi connection       WiFilive TV were inoperative after take off for 45 min,Business Class
"Customer paid for sing the WIFI, but it but did not work     Shortly after take off, Mr Botwe complained that he can not connect to the internet   Mr Botwe paid for the package of 500MG   Mr Botwe did not use the WiFi as both his devices did not",Business Class
"There was multiple disruption in WIFI service during the flight  The customers complained that the WIFI is on and off, impossible to enjoy whole they paid for the service",Business Class
on board WIFI on and off   Mr Kandhari claimed and complained that the on board WIFI was on and off through out the flight,Business Class
Three hours into the flight internet got disconnected & customer were receiving the message service not available  Some customers were not very happy & kept continuously asking for updates,First Class
In operative WIFI                     The Wifi service was in operative throughout the flight According to the captain there was no connection from the beginning of the flight The CMT screen displayed the same ( No Connection ) throughout the flight Few customers complained to the crew regarding the in operative WifI,First Class
"Three hours into the flight, we experienced technical difficulties with the WiFi   Mr NAKASHIMA claimed that he bought a package and couldn't use it   Customer asked about how to get a refund",Business Class
No internet connection Three customers in YC reported that no internet connection,Economy Class
During the flight the customer complained that he paid 999USD for the Wifi  internet connection but was only able to use it for few minutes and it got disconnected The customer claimed that he wasn't able to use the wifi  internet after the first disconnection and was requesting for a refund pauldaugalis@gmailcom 37068503203,Economy Class
WiFi stoppe working  Customer informed me that his WIFI connection just stopped working after 20 minutes he connected,Business Class
WIFI FEEDBACK  Customer commented that the on board wi fi service was very bad  He tried connecting several times and even paid for the internet service but failed to connect,Business Class
Customer paid to use 150 MB of wifi on todays flight and was unable to get a connection for the duration of the flight,Economy Class
"47K customer bought WiFi, got confirmation, used it for a while then got disconnected When he tried reconnecting, he was asked to pay again      customer claimed that he paid for the on board WiFi and got confirmation on his email   he said he only used it for a while   however, he got disconnected and when he tried reconnecting, he was prompted to pay again   kindly look into this issue Email add: jaylordflores42@gmailcom Reference : 36856660 Package : USD 999",Economy Class
"Wi Fi didn't work   Mr Hansen purchased Wi Fi for 10 USA dollars, however Wi Fi didn't work",Economy Class
"WIFI unavailable       Mr Daemers purchased 500MB data plan for 15,99USD, however 15 minutes after he completed the purchase the WiFi system stopped working Mr Daemers showed me a text message a proof of payment",Business Class
CUSTOMER FEEDBACK ABOUT THE WIFI   Mr Giacomo complained about the Wi Fi service being too slow   He said the on board Wi Fi speed was never improved for the past five years,Business Class
Customer claims that he paid for the Wi Fi 999 dollars but it didn't worked,Economy Class
"Upon disembarking the aircraft, Mr Smurthwaite approached me and claimed he had paid 1599 USD for his internet and the same did not work during the flight   The internet indeed did not work throughout the whole flight   I gave the customer the email",Economy Class
WIFI not working,First Class
"WIFI AND LIVE TV COVERAGE INOP    Approximately two hours after take off, customers started complaining about WIFI and Live TV not working   The screens on pax phone shows No cruising altitude reached Area we are flying to is has no satellitel coverage   FAP Connectivity screen says LIVE TV  WIFI connectivity is NA The aircraft is fitted with Ku Satellite Coverage   CMT screen say KU Satellite is OFF and no option to do a reset",Business Class
"Mr Valerian said that Wi Fi speed is slow So, he couldn't utilized the Si fi system properly  He would like to refund the On Air WiFi",Economy Class
"Mr Nicol complained of WiFi unavailability over the ocean   The information paper about the WiFi was not found in the seat pocket   Mr Nicol was not aware of not having WiFi over certain zones, purchased 90MB and used 13MB till 50minutes to landing",Economy Class
"Complaint for on air wifi   MsYang claimed that she purchased 150MB for 999 USD and she sent one text , and it showed that she consumed all of her MB  Ms Yang tried to use again and paid for on air wifi and it was connected and managed to send one text and right after she got a pop up message saying,  All MBs was consumed  Customer want to get refund for this two purchase  orangeboni@hotmailcom",Business Class
"Complaint for on air wifi   MsYang claimed that she purchased 150MB for 999 USD and she sent one text , and it showed that she consumed all of her MB  Ms Yang tried to use again and paid for on air wifi and it was connected and managed to send one text and right after she got a pop up message saying,  All MBs was consumed  Customer want to get refund for this two purchase  orangeboni@hotmailcom",Business Class
Wifi was not working throughout the flight in all cabin,Business Class
"Ms Gohil stated that she purchased the WiFi plan of USD 929 during the flight , it was working the0and at some point stopped   She had to purchase another plan of USD 929 and the new plan worked properly",Economy Class
WIFI Inoperative     Please be advised that the wifi was inoperative for the duration of the flight,First Class
"Aeromobile and Wi Fi unavailable during the flight      After reaching cruising altitude, while starting with the drink service in J class, many customers brought to crew attention that there was no Wi Fi available with a message Cruising Altitude Not Reached",Business Class
after three hours from take off Mr FOY stated that the WIFI service is INOP at his mobile When He was trying to use his skywards number it was giving him Message that He is skywards number is not registered on the flight,Business Class
WI FI in OPT   Due to technical problem Wi Fi was not working   The defect was all ready logged in to the defect log book   Many customer kept requesting for the service,Economy Class
Customer paid 999 USD for the internet  The internet was allegedly very slow,Economy Class
Internet not working  Customer stated he purchased the highest package of data for his laptop  Customer was using the free Wi Fi for his phone but needed extra data for his work on his laptop  Customer stated he made the purchase around four hours into the flight  After the purchase he could not connect and he could not make it work  Customer asked for a refund and was directed to make a claim online,Business Class
Internet not working  Customer stated he purchased the highest package of data for his laptop  Customer was using the free Wi Fi for his phone but needed extra data for his work on his laptop  Customer stated he made the purchase around four hours into the flight  After the purchase he could not connect and he could not make it work  Customer asked for a refund and was directed to make a claim online,Business Class
Internet not working  Customer stated he purchased the highest package of data for his laptop  Customer was using the free Wi Fi for his phone but needed extra data for his work on his laptop  Customer stated he made the purchase around four hours into the flight  After the purchase he could not connect and he could not make it work  Customer asked for a refund and was directed to make a claim online,Business Class
wifi went inop for approximately 2hrs during the flight,First Class
Airshow   The flight details for this sector were correctly entered  4 hours before landing the airshow started to display 'We'll shortly be arriving in Dubai at gate A5' and the flight connections summary,Economy Class
During disembarkation customer complained about on board internet       During disembarkation customer stated he bought the on board internet thinking that it would last for both sector,Economy Class
Mr Muhumed purchased 500MB however after a few minutes he lost connection All other customers were able to coonect and use the WiFi  Customers contact details:  Ph no  4407588249612 Email address: raef8m@hotmailcom raefalfarra@hotmailcom,Economy Class
"Mr Patel mentioned every times he flies with Emirates, when he used on board WIFI or FC lounge WIFI he is not able to connect to his worked email even though he was able to do this in the past Mr Patel also confirm that he don't face this problem on any other public WIFI This issue is a serious point of concern to Mr Patel as he need to follow with his work E Mail during long flights Contact information; Manish Patel Managing Director PO Box 5192,Technopark, Jebel Ali,Dubai, UAE Tel (9714) 886 7997 Email : manish@geapgroupcom",First Class
Customer was unable to connect to the on board WiFi She paid 1000 for 150mb and requested a refund Contact: aneeqaahmed95@hotmailcouk 44 075 284 913 24,Economy Class
WI FI connection  Wi fi didn't work even after passing the restricted air space  Few customers complaint in JC,Business Class
On Air Issue   Mr Abdullah had purchased internet for 699 usd 150mb and claimed that it stopped working at less than an hour,Economy Class
Passenger informed crew that WiFi is not working  Customer appears to be once the Wi Fi worked passenger appeared to be ok when disembarked,Business Class
"Connected but wouldn't work     Miss Kordahi seated at 59H had paid for onair WiFi 150mb charged her 18dhs, but wouldn't connect  The browser kept giving a blank screen and saying please connect every time  Would like a refund or explanation why it wouldn't work  Email   patriciakordahi@yahoocom",Economy Class
"NOT CONNECTED AT ALL  SKYWARDS AND PAYMENT    After take off, Mr Bahn could not connect using his Skywards details  A message displayed saying your skywards details are not attached to this flight",First Class
"WIFI not connecting  During cruise customer claimed that she could not access the WIFI   On explaining to her how to use it, customer claimed that she was Gold skywards and that she knows that she is entitled for free WIFI  Customer was then informed to include her skywards number or email number while logging in on the skywards page  Customer then claimed that the page displayed that she was not a skywards number and that her number was incorrect  Customer then claimed that she would use the paid WiFi but would like emirates to refund her Stating Its not my fault that they did not include my skywards number when I booked the ticket   On sealing to customer later,Customer then claimed that she did not use the paid WIFI as she was watching IFE all through FYI :On customers profile on the kiss tablet it states that customer is not a skywards member Email: hajramohajir@hnhscientificcom Tel:19054653472",Business Class
"Customer purchased the 9 plan however, the wifi connection went off soon after and customer did not get the connection back even after the wifi came back on",Economy Class
On Air Wifi  On Air was not available during the flight  CIDS FAP page states external application is currently not available,First Class
Customer claimed that he paid for the on air internet and it was not working during the flight  customer asked for a refund  The Email that the customer used for internet login is (cyclefitde@gmailcom)  Customer claimed the amount he paid for the inte,Business Class
customers complained about the old aircraft and IFE system since its not touch screen and we had to reset the system few times as it wasn't working,Business Class
Please be advised that the WIFI and Aeromobile were not consistent on This flight and was continuously going in and out,Business Class
"CUSTOMERS UNHAPPY AS WIFI IS VERY SLOW   During the flight, a 3 customers complained stating that the Wi Fi was very slow",Business Class
Customer had paid 15 dollars for internet but it was not functioning at all Katiesclassy@aolcom 971556025395,Business Class
Mr Aliahmad complained because the internet speed was too low and eventually stopped working,Economy Class
Live TV did not work properly   Lots of customers were looking forward to watch the world cup match on board   Live TV was not working most of the flight   Customers complained about the Live TV   Customers were happy they could see the end results and last few minutes of the game,Business Class
Passenger was not happy since he could not connect to the entitled free WIFI  He managed to use the 20 free mbs only,First Class
Wifi connectivity   A few customers complained since the Wifi was not working (Live Tv was working fine),Economy Class
Customer would like refund for his WiFi payment        The customer paid for the US 1500 WiFi package however the WiFi stopped working  The WiFi was reset however it kept going on and off and the customer got upset and asked for a refund,Economy Class
WiFi not working   Mr Narikiyo stated that he paid for 500MB internet and it wasn't working on his device (iPhone)   Mr Narikiya seemed quite upset due to this   Contact details as follows masahironarikiyo@sumitomocorpcom 971564161254,Business Class
During cruise the customer approached Purser Jung Eon and complained that his WIFI was not working and could not connect to the internet Politely explained to the customer that the internet currently does not have any network connection from the service provider but it should connect after few hours The customer said that he wants to use the WIFI now and that he couldn't wait after few hours because he was going to sleep The customer requested for a refund of 1599USD for his WIFI fvazille@gmailcom 61411705039,Business Class
customer was disappointed Due to the WIFI was slow not opening browser or not retrieving his personal emails on his phone and tablet  This was brought to my attention 1:45 minutes before landing  customer had the same issue on Melbourne flight to Dubai  customer claimed that hi purchased the highest plan,Business Class
Wifi and Live Tv channels were in op on this flight for most of the flight Initially it was working but then it stopped Customers enquired about the wifi usage and football results,Business Class
"500MB PURCHASED   Customer claimed that he and his sister (travelling together) both paid for WIFI His worked for one minute and then stopped working, stating his sisters continued to work fine   Customer had a Samsung phone WIFI was turned on (on phone settings) below WIFI ON it stated 'Internet may not be available'",Business Class
During the flight various customers were not happy that the internet was not working properly,Business Class
Wifi refund      Mrs Devey apporached in the galley saying she paid 15 for the wifi but it did not connect Customer contact details: Samantha 777@livecouk 447915661978,Economy Class
Customer complained theta the WiFi was very erratic thought the flight,Business Class
"SUB   NO INTERNET, LIVE TV,DATA AND VOICE There was no TVInternetMobile or Live TV available on this aircraft for this sector",First Class
"During the flight, Ms Zahra mentioned that she had purchased a 15 wifi but it was not working most of the time   She said she was disappointed as she had paid the 15 for the duration of the flight",Business Class
"CUSTOMER ASKED FOR A REFUND OF WIFI   During the bar service, Mr Polosantias informed me that he had purchased the on board wifi, but that it would not work and i it would, it would go extremely slow   The customer requested for a refund of the fare paid",Economy Class
"Customer used the free 20MB and purchased 150MBfor 999USD using a VISA card from MANDIRI BANK with name as DANIEL S PURBA After using 677MB, it stopped working",Economy Class
Inoperative WIFE and Aero mobile   The WIFE and Aero mobile was inoperative,First Class
WIFI INOP Wifi was inop on the AC sectors operated ek 478 dated 30may2018 and ek 478 dated 31may 2018,Economy Class
customer claimed that he paid 15 for WiFi but he was not connected   customer said he used the free WiFi first and then paid with his card    customer was asking for his refund Contact : Shahbazalimirza@osncom 0556245220,Economy Class
During descent Mr Nowak asked the crew if the wi Fi was working  He used the free wi Fi and after He finished the free wi Fi He tried to purchase using credit card  He said after paying the wi Fi stopped working,Economy Class
customer could not connect with his skywards email and password and bought the Paid WiFi  customer would like to have A refund,Business Class
Mr Sahid Yusuf complained regarding Paid WIFI service,Economy Class
