description,subcategory
Customer drank from own alcohol bottle     Mr Pauwels and the few people he was traveling with were observed drinking from their own bottle after take off,Economy Class
Customer complaints due to the fast track card     Fast track card in to LHR was not offered to HVC in economy according to the procedure  However some HVC requested for the Fast track card and complained they had been offered on their previous flights to LHR so far,Economy Class
Customer complained of Diarrhoea    Mr Prin informed us that he was having diarrhoea at top of decent  He said he had pain in his stomach and was feeling cold  MIRF number 363543,Business Class
"Customer and her husband came to business lounge without crews knowledge  During the flight the customer and her husband used the forward stairs and approached the business lounge This was done without the crews knowledge or permission  Mrs Shalev took the one empty seat at 26g and lied down , while her husband was in the lounge talking to the crew",First Class
"Crew operated a higher grade, as CSV    Liliana was pulled out of home standby 2100h  She was allocated R2A position, CSV in J class, which she operated as the entire flight  Kindly adjust her flying pay accordingly",Economy Class
TURBULENCE      Due to moderate turbulence (at 2215 GMT) all crew were asked to take their seats for approximately 15 mins,Business Class
"Landing cards were not available for all the customers grovelling in Y class       After take off, lots of customers came to the Galley and asked if we have any available landing cards because they did not receive at all",Business Class
Customer felt uncomfortable with the customer seat at the row behind     Mr Cheung original seat was at 17G  Mr Cheung asked the crew to tell the other customer who sat behind him to wear the face mask  He did mention that the customer behind kept sneezing and blew the nose  He asked to the crew to offer the face mask because he did not want to get infected,Business Class
"Customer dissatisfaction due to IFE in op      After the dinner service, Ms Joko approached me and said that her IFE stopped working about 15min after take off   Ms Joko said she asked few crews to reset the system but none came to check on her afterwards   Ms Joko was very angry and upset",Business Class
Customer asked for socks (21H),Economy Class
MODE CONTROLLER NOT WORKING       Just after take off Ms Atallah brought to crew attention that her mode controller was not working,Economy Class
"Customers not aware about transit          During boarding, we find a lot of customers were not aware that is a transit flight The customers stated that they did the booking through Emirates website & it was not mention stop over or transit",Economy Class
"Inappropriate comments         After been offered for another hot beverage after his dessert, Mr Ramdjee stated to crew member (Adriana Lourenco Da Silva Morais Sequeira Staff ID 427267) I would like to ask you something else; but I don't know i",Business Class
